;name;year;runtme;genre;ratng;metascore;tmelne;votes;base;gross
574;A Nght at the Opera;1935;96;Comedy, Musc, Muscal;7.9;;A sly busness manager and two wacky frends of two opera sngers help them acheve success whle humlatng ther stuffy and snobbsh enemes.;30,964;2,54; R$ 2.540.000,00 
575;Kng Kong;1933;100;Adventure, Horror, Sc-F;7.9;90;A flm crew goes to a tropcal sland for an exotc locaton shoot and dscovers a colossal ape who takes a shne to ther female blonde star. He s then captured and brought back to New York Cty for publc exhbton.;80,53;10; R$ 10.000.000,00 
582;The Salesman;2016;124;Drama;7.8;85;"Whle both partcpatng n a producton of ""Death of a Salesman,"" a teacher's wfe s assaulted n her new home, whch leaves hm determned to fnd the perpetrator over hs wfe's traumatzed objectons.";53,028;2,4; R$ 2.400.000,00 
583;Dunkrk;2017;106;Acton, Drama, Hstory;7.8;94;Alled solders from Belgum, the Brtsh Commonwealth and Empre, and France are surrounded by the German Army and evacuated durng a ferce battle n World War .;573,375;188,37; R$ 188.370.000,00 
585;Hdden Fgures;2016;127;Bography, Drama, Hstory;7.8;74;The story of a team of female Afrcan-Amercan mathematcans who served a vtal role n NASA durng the early years of the U.S. space program.;206,521;169,61; R$ 169.610.000,00 
586;Paddngton 2;2017;103;Anmaton, Adventure, Comedy;7.8;88;Paddngton (Ben Whshaw), now happly settled wth the Brown famly and a popular member of the local communty, pcks up a seres of odd jobs to buy the perfect present for hs Aunt Lucy's (melda Staunton's) 100th brthday, only for the gft to be stolen.;64,555;40,44; R$ 40.440.000,00 
588;Kubo and the Two Strngs;2016;101;Anmaton, Acton, Adventure;7.8;84;A young boy named Kubo must locate a magcal sut of armour worn by hs late father n order to defeat a vengeful sprt from the past.;120,196;48,02; R$ 48.020.000,00 
589;Manchester by the Sea;2016;137;Drama;7.8;96;A depressed uncle s asked to take care of hs teenage nephew after the boy's father des.;253,965;47,7; R$ 47.700.000,00 
590;Land of Mne;2015;100;Drama, Hstory, War;7.8;75;n post-World War Denmark, a group of young German POWs are forced to clear a beach of thousands of land mnes under the watch of a Dansh Sergeant who slowly learns to apprecate ther plght.;37,047;0,44; R$ 440.000,00 
591;Rogue One: A Star Wars Story;2016;133;Acton, Adventure, Sc-F;7.8;65;The daughter of an mperal scentst jons the Rebel Allance n a rsky move to steal the plans for the Death Star.;567,513;532,18; R$ 532.180.000,00 
592;Captan Amerca: Cvl War;2016;147;Acton, Adventure, Sc-F;7.8;75;Poltcal nvolvement n the Avengers' affars causes a rft between Captan Amerca and ron Man.;684,84;408,08; R$ 408.080.000,00 
593;The Hateful Eght;2015;168;Crme, Drama, Mystery;7.8;68;n the dead of a Wyomng wnter, a bounty hunter and hs prsoner fnd shelter n a cabn currently nhabted by a collecton of nefarous characters.;531,468;54,12; R$ 54.120.000,00 
594;Lttle Women;2019;135;Drama, Romance;7.8;91;Jo March reflects back and forth on her lfe, tellng the beloved story of the March ssters - four young women, each determned to lve lfe on her own terms.;154,234;108,1; R$ 108.100.000,00 
595;Lovng Vncent;2017;94;Anmaton, Bography, Crme;7.8;62;n a story depcted n ol panted anmaton, a young man comes to the last hometown of panter Vncent van Gogh (Robert Gulaczyk) to delver the troubled artst's fnal letter and ends up nvestgatng hs fnal days there.;52,341;6,74; R$ 6.740.000,00 
597;Nghtcrawler;2014;117;Crme, Drama, Thrller;7.8;76;When Lous Bloom, a con man desperate for work, muscles nto the world of L.A. crme journalsm, he blurs the lne between observer and partcpant to become the star of hs own story.;479,697;32,38; R$ 32.380.000,00 
598;The Great Beauty;2013;141;Drama;7.8;86;Jep Gambardella has seduced hs way through the lavsh nghtlfe of Rome for decades, but after hs 65th brthday and a shock from the past, Jep looks past the nghtclubs and partes to fnd a tmeless landscape of absurd, exquste beauty.;82,678;2,85; R$ 2.850.000,00 
599;The Lunchbox;2013;104;Drama, Romance;7.8;76;A mstaken delvery n Mumba's famously effcent lunchbox delvery system connects a young housewfe to an older man n the dusk of hs lfe as they buld a fantasy world together through notes n the lunchbox.;51,776;4,23; R$ 4.230.000,00 
600;Vcky Donor;2012;126;Comedy, Romance;7.8;;A man s brought n by an nfertlty doctor to supply hm wth hs sperm, where he becomes the bggest sperm donor for hs clnc.;40,35;0,17; R$ 170.000,00 
601;Bg Hero 6;2014;102;Anmaton, Acton, Adventure;7.8;74;A specal bond develops between plus-szed nflatable robot Baymax and prodgy Hro Hamada, who together team up wth a group of frends to form a band of hgh-tech heroes.;418,602;222,53; R$ 222.530.000,00 
602;KaPo Che;2013;120;Drama, Sport;7.8;40;Three frends growng up n nda at the turn of the mllennum set out to open a tranng academy to produce the country's next crcket stars.;33,681;1,12; R$ 1.120.000,00 
603;About Tme;2013;123;Comedy, Drama, Fantasy;7.8;55;At the age of 21, Tm dscovers he can travel n tme and change what happens and has happened n hs own lfe. Hs decson to make hs world a better place by gettng a grlfrend turns out not to be as easy as you mght thnk.;313,205;15,32; R$ 15.320.000,00 
604;Englsh Vnglsh;2012;134;Comedy, Drama, Famly;7.8;;A quet, sweet tempered housewfe endures small slghts from her well-educated husband and daughter every day because of her nablty to speak and understand Englsh.;34,14;1,67; R$ 1.670.000,00 
605;The Wnd Rses;2013;126;Anmaton, Bography, Drama;7.8;83;A look at the lfe of Jro Horkosh, the man who desgned Japanese fghter planes durng World War .;76,178;5,21; R$ 5.210.000,00 
606;The Best Offer;2013;131;Crme, Drama, Mystery;7.8;49;A lonely art expert workng for a mysterous and reclusve heress fnds not only her art worth examnng.;110,921;0,09; R$ 90.000,00 
607;Moonrse Kngdom;2012;94;Comedy, Drama, Romance;7.8;84;A par of young lovers flee ther New England town, whch causes a local search party to fan out to fnd them.;324,941;45,51; R$ 45.510.000,00 
608;How to Tran Your Dragon 2;2014;102;Anmaton, Acton, Adventure;7.8;76;When Hccup and Toothless dscover an ce cave that s home to hundreds of new wld dragons and the mysterous Dragon Rder, the two frends fnd themselves at the center of a battle to protect the peace.;310,454;177; R$ 177.000.000,00 
609;The Bg Short;2015;130;Bography, Comedy, Drama;7.8;81;n 2006-2007 a group of nvestors bet aganst the US mortgage market. n ther research they dscover how flawed and corrupt the market s.;376,068;70,26; R$ 70.260.000,00 
610;Saw the Devl;2010;144;Acton, Crme, Drama;7.8;67;A secret agent exacts revenge on a seral kller through a seres of captures and releases.;114,977;0,13; R$ 130.000,00 
611;The Grl wth the Dragon Tattoo;2011;158;Crme, Drama, Mystery;7.8;71;Journalst Mkael Blomkvst s aded n hs search for a woman who has been mssng for forty years by Lsbeth Salander, a young computer hacker.;431,088;102,52; R$ 102.520.000,00 
612;Captan Phllps;2013;134;Adventure, Bography, Crme;7.8;82;The true story of Captan Rchard Phllps and the 2009 hjackng by Somalprates of the U.S.-flagged MV Maersk Alabama, the frst Amercan cargo shp to be hjacked n two hundred years.;428,185;107,1; R$ 107.100.000,00 
613;The Man from Nowhere;2010;119;Acton, Crme, Drama;7.8;;A quet pawnshop keeper wth a volent past takes on a drug-and-organ traffckng rng n hope of savng the chld who s hs only frend.;64,399;0,01; R$ 10.000,00 
614;Straght Outta Compton;2015;147;Bography, Drama, Hstory;7.8;72;The rap group NWA emerges from the mean streets of Compton n Los Angeles, Calforna, n the md-1980s and revolutonzes Hp Hop culture wth ther musc and tales about lfe n the hood.;183,448;161,2; R$ 161.200.000,00 
615;The rshman;2019;209;Bography, Crme, Drama;7.8;94;Htman Frank Sheeran looks back at the secrets he kept as a loyal member of the Bufalno crme famly.;338,278;7; R$ 7.000.000,00 
616;Mother;2009;129;Crme, Drama, Mystery;7.8;79;A mother desperately searches for the kller who framed her son for a grl's horrfc murder.;55,341;0,55; R$ 550.000,00 
618;The Hobbt: The Desolaton of Smaug;2013;161;Adventure, Fantasy;7.8;66;The dwarves, along wth Blbo Baggns and Gandalf the Grey, contnue ther quest to reclam Erebor, ther homeland, from Smaug. Blbo Baggns s n possesson of a mysterous and magcal rng.;610,434;258,37; R$ 258.370.000,00 
619;The Whte Rbbon;2009;144;Drama, Hstory, Mystery;7.8;82;Strange events happen n a small vllage n the north of Germany durng the years before World War , whch seem to be rtual punshment. Who s responsble?;69,687;2,22; R$ 2.220.000,00 
620;The Grl wth the Dragon Tattoo;2009;152;Crme, Drama, Mystery;7.8;76;A journalst s aded by a young female hacker n hs search for the kller of a woman who has been dead for forty years.;210,552;10,1; R$ 10.100.000,00 
623;The Fghter;2010;116;Bography, Drama, Sport;7.8;79;Based on the story of Mcky Ward, a fledglng boxer who tres to escape the shadow of hs more famous but troubled older boxng brother and get hs own shot at greatness.;345,726;93,62; R$ 93.620.000,00 
624;Taken;2008;90;Acton, Crme, Thrller;7.8;51;A retred CA agent travels across Europe and reles on hs old sklls to save hs estranged daughter, who has been kdnapped whle on a trp to Pars.;570,887;145; R$ 145.000.000,00 
625;The Boy n the Strped Pajamas;2008;94;Drama, Hstory, War;7.8;55;Through the nnocent eyes of Bruno, the eght-year-old son of the commandant at a German concentraton camp, a forbdden frendshp wth a Jewsh boy on the other sde of the camp fence has startlng and unexpected consequences.;194,655;9,03; R$ 9.030.000,00 
626;Once;2007;86;Drama, Musc, Romance;7.8;88;A modern-day muscal about a busker and an mmgrant and ther eventful week n Dubln, as they wrte, rehearse and record songs that tell ther love story.;111,811;9,44; R$ 9.440.000,00 
627;The Hobbt: An Unexpected Journey;2012;169;Adventure, Fantasy;7.8;58;A reluctant Hobbt, Blbo Baggns, sets out to the Lonely Mountan wth a sprted group of dwarves to reclam ther mountan home, and the gold wthn t from the dragon Smaug.;767,526;303; R$ 303.000.000,00 
628;The Edge of Heaven;2007;122;Drama;7.8;85;A Turksh man travels to stanbul to fnd the daughter of hs father's former grlfrend.;31,087;0,74; R$ 740.000,00 
629;Atonement;2007;123;Drama, Mystery, Romance;7.8;85;Thrteen-year-old fledglng wrter Brony Talls rrevocably changes the course of several lves when she accuses her older sster's lover of a crme he dd not commt.;256,733;50,93; R$ 50.930.000,00 
630;Drve;2011;100;Crme, Drama;7.8;78;A mysterous Hollywood stuntman and mechanc moonlghts as a getaway drver and fnds hmself n trouble when he helps out hs neghbor.;582,181;35,06; R$ 35.060.000,00 
631;Amercan Gangster;2007;157;Bography, Crme, Drama;7.8;76;An outcast New York Cty cop s charged wth brngng down Harlem drug lord Frank Lucas, whose real lfe nspred ths partly bographcal flm.;398,8;130,16; R$ 130.160.000,00 
632;Avatar;2009;162;Acton, Adventure, Fantasy;7.8;83;A paraplegc Marne dspatched to the moon Pandora on a unque msson becomes torn between followng hs orders and protectng the world he feels s hs home.;1,135,001;760,51; R$ 760.510.000,00 
633;Mr. Nobody;2009;141;Drama, Fantasy, Romance;7.8;63;A boy stands on a staton platform as a tran s about to leave. Should he go wth hs mother or stay wth hs father? nfnte possbltes arse from ths decson. As long as he doesn't choose, anythng s possble.;220,002;0; R$ -   
634;Apocalypto;2006;139;Acton, Adventure, Drama;7.8;68;As the Mayan kngdom faces ts declne, a young man s taken on a perlous journey to a world ruled by fear and oppresson.;295,01;50,87; R$ 50.870.000,00 
635;Lttle Mss Sunshne;2006;101;Comedy, Drama;7.8;80;A famly determned to get ther young daughter nto the fnals of a beauty pageant take a cross-country trp n ther VW bus.;446,608;59,89; R$ 59.890.000,00 
636;Hot Fuzz;2007;121;Acton, Comedy, Mystery;7.8;81;A sklled London polce offcer s transferred to a small town wth a dark secret.;471,628;23,64; R$ 23.640.000,00 
637;The Curous Case of Benjamn Button;2008;166;Drama, Fantasy, Romance;7.8;70;Tells the story of Benjamn Button, a man who starts agng backwards wth consequences.;600,444;127,51; R$ 127.510.000,00 
638;Veer-Zaara;2004;192;Drama, Famly, Muscal;7.8;67;Veer-Zaara s a saga of love, separaton, courage and sacrfce. A love story that s an nspraton and wll reman a legend forever.;49,831;2,92; R$ 2.920.000,00 
639;Adam's Apples;2005;94;Comedy, Crme, Drama;7.8;51;A neo-nazsentenced to communty servce at a church clashes wth the blndly devotonal prest.;46,851;0; R$ -   
640;Prde & Prejudce;2005;129;Drama, Romance;7.8;82;Sparks fly when sprted Elzabeth Bennet meets sngle, rch, and proud Mr. Darcy. But Mr. Darcy reluctantly fnds hmself fallng n love wth a woman beneath hs class. Can each overcome ther own prde and prejudce?;265,809;38,41; R$ 38.410.000,00 
641;The World's Fastest ndan;2005;127;Bography, Drama, Sport;7.8;68;The story of New Zealander Burt Munro, who spent years rebuldng a 1920 ndan motorcycle, whch helped hm set the land speed world record at Utah's Bonnevlle Salt Flats n 1967.;52,587;5,13; R$ 5.130.000,00 
642;Tokyo Godfathers;2003;92;Anmaton, Adventure, Comedy;7.8;73;On Chrstmas Eve, three homeless people lvng on the streets of Tokyo dscover a newborn baby among the trash and set out to fnd ts parents.;32,808;0,13; R$ 130.000,00 
643;Serenty;2005;119;Acton, Adventure, Sc-F;7.8;74;The crew of the shp Serenty try to evade an assassn sent to recapture telepath Rver.;285,74;25,51; R$ 25.510.000,00 
644;Walk the Lne;2005;136;Bography, Drama, Musc;7.8;72;A chroncle of country musc legend Johnny Cash's lfe, from hs early days on an Arkansas cotton farm to hs rse to fame wth Sun Records n Memphs, where he recorded alongsde Elvs Presley, Jerry Lee Lews, and Carl Perkns.;237,281;119,52; R$ 119.520.000,00 
645;Evl;2003;113;Drama;7.8;61;A teenage boy expelled from school for fghtng arrves at a boardng school where the systematc bullyng of younger students s encouraged as a means to mantan dscplne, and decdes to fght back.;36,062;0,02; R$ 20.000,00 
646;The Notebook;2004;123;Drama, Romance;7.8;53;A poor yet passonate young man falls n love wth a rch young woman, gvng her a sense of freedom, but they are soon separated because of ther socal dfferences.;529,972;81; R$ 81.000.000,00 
647;The Motorcycle Dares;2004;126;Adventure, Bography, Drama;7.8;75;The dramatzaton of a motorcycle road trp Che Guevara went on n hs youth that showed hm hs lfe's callng.;97,835;16,76; R$ 16.760.000,00 
648;Llya 4-Ever;2002;109;Crme, Drama;7.8;82;Sxteen-year-old Llja and her only frend, the young boy Volodja, lve n Russa, fantaszng about a better lfe. One day, Llja falls n love wth Andrej, who s gong to Sweden, and nvtes Llja to come along and start a new lfe.;43,286;0,18; R$ 180.000,00 
649;The Trplets of Bellevlle;2003;80;Anmaton, Comedy, Drama;7.8;91;When her grandson s kdnapped durng the Tour de France, Madame Souza and her beloved pooch Bruno team up wth the Bellevlle Ssters--an aged song-and-dance team from the days of Fred Astare--to rescue hm.;51,153;7; R$ 7.000.000,00 
651;Wakng Lfe;2001;99;Anmaton, Drama, Fantasy;7.8;83;A man shuffles through a dream meetng varous people and dscussng the meanngs and purposes of the unverse.;61,413;2,89; R$ 2.890.000,00 
652;Remember the Ttans;2000;113;Bography, Drama, Sport;7.8;48;The true story of a newly apponted Afrcan-Amercan coach and hs hgh school team on ther frst season as a racally ntegrated unt.;200,922;115,65; R$ 115.650.000,00 
653;Crouchng Tger, Hdden Dragon;2000;120;Acton, Adventure, Fantasy;7.8;94;A young Chnese warror steals a sword from a famed swordsman and then escapes nto a world of romantc adventure wth a mysterous man n the fronter of the naton.;256,46;128,08; R$ 128.080.000,00 
654;Cast Away;2000;143;Adventure, Drama, Romance;7.8;73;A FedEx executve undergoes a physcal and emotonal transformaton after crash landng on a deserted sland.;536,52;233,63; R$ 233.630.000,00 
655;The Boondock Sants;1999;108;Acton, Crme, Thrller;7.8;44;Two rsh Catholc brothers become vglantes and wpe out Boston's crmnal underworld n the name of God.;229,313;0,03; R$ 30.000,00 
656;The nsder;1999;157;Bography, Drama, Thrller;7.8;84;A research chemst comes under personal and professonal attack when he decdes to appear n a 60 Mnutes exposé on Bg Tobacco.;161,973;28,97; R$ 28.970.000,00 
657;October Sky;1999;108;Bography, Drama, Famly;7.8;71;The true story of Homer Hckam, a coal mner's son who was nspred by the frst Sputnk launch to take up rocketry aganst hs father's wshes.;84,252;32,48; R$ 32.480.000,00 
658;Ttanc;1997;194;Drama, Romance;7.8;75;A seventeen-year-old arstocrat falls n love wth a knd but poor artst aboard the luxurous, ll-fated R.M.S. Ttanc.;1,067,422;659,33; R$ 659.330.000,00 
659;Freworks;1997;103;Crme, Drama, Romance;7.8;;Nshleaves the polce n the face of harrowng personal and professonal dffcultes. Spralng nto depresson, he makes questonable decsons.;28,341;0,23; R$ 230.000,00 
660;Gattaca;1997;106;Drama, Sc-F, Thrller;7.8;64;A genetcally nferor man assumes the dentty of a superor one n order to pursue hs lfelong dream of space travel.;284,863;12,34; R$ 12.340.000,00 
661;The Game;1997;129;Drama, Mystery, Thrller;7.8;61;After a wealthy banker s gven an opportunty to partcpate n a mysterous game, hs lfe s turned upsde down when he becomes unable to dstngush between the game and realty.;355,779;48,32; R$ 48.320.000,00 
663;Ed Wood;1994;127;Bography, Comedy, Drama;7.8;70;Ambtous but troubled move drector Edward D. Wood Jr. tres hs best to fulfll hs dreams, despte hs lack of talent.;166,752;5,89; R$ 5.890.000,00 
664;Tombstone;1993;130;Acton, Bography, Drama;7.8;50;A successful lawman's plans to retre anonymously n Tombstone, Arzona are dsrupted by the knd of outlaws he was famous for elmnatng.;130,277;56,51; R$ 56.510.000,00 
665;The Sandlot;1993;101;Comedy, Drama, Famly;7.8;55;n the summer of 1962, a new kd n town s taken under the wng of a young baseball prodgy and hs rowdy team, resultng n many adventures.;80,834;32,42; R$ 32.420.000,00 
666;The Remans of the Day;1993;134;Drama, Romance;7.8;86;A butler who sacrfced body and soul to servce n the years leadng up to World War realzes too late how msguded hs loyalty was to hs lordly employer.;68,022;22,95; R$ 22.950.000,00 
667;Naked;1993;132;Comedy, Drama;7.8;84;Parallel tales of two sexually obsessed men, one hurtng and annoyng women physcally and mentally, one wanderng around the cty talkng to strangers and experencng dmensons of lfe.;35,641;1,77; R$ 1.770.000,00 
668;The Fugtve;1993;130;Acton, Crme, Drama;7.8;87;Dr. Rchard Kmble, unjustly accused of murderng hs wfe, must fnd the real kller whle beng the target of a natonwde manhunt led by a seasoned U.S. Marshal.;272,333;183,88; R$ 183.880.000,00 
669;A Bronx Tale;1993;121;Crme, Drama, Romance;7.8;80;A father becomes worred when a local gangster befrends hs son n the Bronx n the 1960s.;130,591;17,27; R$ 17.270.000,00 
670;Batman: Mask of the Phantasm;1993;76;Anmaton, Acton, Crme;7.8;;Batman s wrongly mplcated n a seres of murders of mob bosses actually done by a new vglante assassn.;44,886;5,62; R$ 5.620.000,00 
673;Boyz n the Hood;1991;112;Crme, Drama;7.8;76;Follows the lves of three young males lvng n the Crenshaw ghetto of Los Angeles, dssectng questons of race, relatonshps, volence, and future prospects.;128,774;57,5; R$ 57.500.000,00 
674;Msery;1990;107;Drama, Thrller;7.8;75;After a famous author s rescued from a car crash by a fan of hs novels, he comes to realze that the care he s recevng s only the begnnng of a nghtmare of captvty and abuse.;188,558;61,28; R$ 61.280.000,00 
675;Awakenngs;1990;121;Bography, Drama;7.8;74;The vctms of an encephalts epdemc many years ago have been catatonc ever snce, but now a new drug offers the prospect of revvng them.;128,857;52,1; R$ 52.100.000,00 
679;Back to the Future Part ;1989;108;Adventure, Comedy, Sc-F;7.8;57;After vstng 2015, Marty McFly must repeat hs vst to 1955 to prevent dsastrous changes to 1985...wthout nterferng wth hs frst trp.;490,111;118,5; R$ 118.500.000,00 
680;MssssppBurnng;1988;128;Crme, Drama, Hstory;7.8;65;Two F.B.. Agents wth wldly dfferent styles arrve n Mssssppto nvestgate the dsappearance of some cvl rghts actvsts.;90,418;34,6; R$ 34.600.000,00 
681;Predator;1987;107;Acton, Adventure, Sc-F;7.8;45;A team of commandos on a msson n a Central Amercan jungle fnd themselves hunted by an extraterrestral warror.;377,689;59,74; R$ 59.740.000,00 
682;Ferrs Bueller's Day Off;1986;103;Comedy;7.8;61;A hgh school wse guy s determned to have a day off from school, despte what the Prncpal thnks of that.;326,537;70,14; R$ 70.140.000,00 
683;The Goones;1985;114;Adventure, Comedy, Famly;7.8;62;A group of young msfts called The Goones dscover an ancent map and set out on an adventure to fnd a legendary prate's long-lost treasure.;248,941;61,5; R$ 61.500.000,00 
684;The Color Purple;1985;154;Drama;7.8;78;A black Southern woman struggles to fnd her dentty after sufferng abuse from her father and others over four decades.;80,126;98,47; R$ 98.470.000,00 
685;The Breakfast Club;1985;97;Comedy, Drama;7.8;66;Fve hgh school students meet n Saturday detenton and dscover how they have a lot more n common than they thought.;363,344;45,88; R$ 45.880.000,00 
686;The Kllng Felds;1984;141;Bography, Drama, Hstory;7.8;76;A journalst s trapped n Camboda durng tyrant Pol Pot's bloody 'Year Zero' cleansng campagn, whch clamed the lves of two mllon 'undesrable' cvlans.;52,452;34,7; R$ 34.700.000,00 
687;Ghostbusters;1984;105;Acton, Comedy, Fantasy;7.8;71;Three former parapsychology professors set up shop as a unque ghost removal servce.;361,591;238,63; R$ 238.630.000,00 
688;The Rght Stuff;1983;193;Adventure, Bography, Drama;7.8;91;The story of the orgnal Mercury 7 astronauts and ther macho, seat-of-the-pants approach to the space program.;56,932;21,5; R$ 21.500.000,00 
689;The Kng of Comedy;1982;109;Comedy, Crme, Drama;7.8;73;Rupert Pupkn s a passonate yet unsuccessful comc who craves nothng more than to be n the spotlght and to acheve ths, he stalks and kdnaps hs dol to take the spotlght for hmself.;92,632;2,5; R$ 2.500.000,00 
690;E.T. the Extra-Terrestral;1982;115;Famly, Sc-F;7.8;91;A troubled chld summons the courage to help a frendly alen escape Earth and return to hs home world.;378,313;435,11; R$ 435.110.000,00 
691;Kramer vs. Kramer;1979;105;Drama;7.8;77;Ted Kramer's wfe leaves hm, allowng for a lost bond to be redscovered between Ted and hs son, Blly. But a heated custody battle ensues over the dvorced couple's son, deepenng the wounds left by the separaton.;136,072;106,26; R$ 106.260.000,00 
693;The Outlaw Josey Wales;1976;135;Western;7.8;69;Mssourfarmer Josey Wales jons a Confederate guerrlla unt and wnds up on the run from the Unon solders who murdered hs famly.;66,71;31,8; R$ 31.800.000,00 
695;The Conversaton;1974;113;Drama, Mystery, Thrller;7.8;85;A paranod, secretve survellance expert has a crss of conscence when he suspects that the couple he s spyng on wll be murdered.;101,397;4,42; R$ 4.420.000,00 
696;Fantastc Planet;1973;72;Anmaton, Sc-F;7.8;73;On a faraway planet where blue gants rule, oppressed humanods rebel aganst ther machne-lke leaders.;26,589;0,19; R$ 190.000,00 
697;The Day of the Jackal;1973;143;Crme, Drama, Thrller;7.8;80;"A professonal assassn codenamed ""Jackal"" plots to kll Charles de Gaulle, the Presdent of France.";38,149;16,06; R$ 16.060.000,00 
699;Cabaret;1972;124;Drama, Musc, Muscal;7.8;80;A female grle club entertaner n Wemar Republc era Berln romances two men whle the NazParty rses to power around them.;49,117;42,77; R$ 42.770.000,00 
700;Wlly Wonka & the Chocolate Factory;1971;100;Famly, Fantasy, Muscal;7.8;67;A poor but hopeful boy seeks one of the fve coveted golden tckets that wll send hm on a tour of Wlly Wonka's mysterous chocolate factory.;181,642;4; R$ 4.000.000,00 
701;Mdnght Cowboy;1969;113;Drama;7.8;79;A nave hustler travels from Texas to New York Cty to seek personal fortune, fndng a new frend n the process.;102,799;44,79; R$ 44.790.000,00 
702;Wat Untl Dark;1967;108;Thrller;7.8;81;A recently blnded woman s terrorzed by a tro of thugs whle they search for a heron-stuffed doll they beleve s n her apartment.;28,211;17,55; R$ 17.550.000,00 
703;Guess Who's Comng to Dnner;1967;108;Comedy, Drama;7.8;63;A couple's atttudes are challenged when ther daughter ntroduces them to her Afrcan-Amercan fancé.;40,612;56,7; R$ 56.700.000,00 
705;My Far Lady;1964;170;Drama, Famly, Muscal;7.8;95;Snobbsh phonetcs Professor Henry Hggns agrees to a wager that he can make flower grl Elza Doolttle presentable n hgh socety.;88,324;72; R$ 72.000.000,00 
706;Mary Poppns;1964;139;Comedy, Famly, Fantasy;7.8;88;n turn of the century London, a magcal nanny employs musc and adventure to help two neglected chldren become closer to ther father.;160,373;102,27; R$ 102.270.000,00 
707;The Longest Day;1962;178;Acton, Drama, Hstory;7.8;75;The events of D-Day, told on a grand scale from both the Alled and German ponts of vew.;52,709;39,1; R$ 39.100.000,00 
709;The nnocents;1961;100;Horror;7.8;88;A young governess for two chldren becomes convnced that the house and grounds are haunted.;27,648;2,62; R$ 2.620.000,00 
710;Breathless;1960;90;Crme, Drama;7.8;;A small-tme thef steals a car and mpulsvely murders a motorcycle polceman. Wanted by the authortes, he reuntes wth a hp Amercan journalsm student and attempts to persuade her to run away wth hm to taly.;74,776;0,34; R$ 340.000,00 
711;The Quet Man;1952;129;Comedy, Drama, Romance;7.8;;A retred Amercan boxer returns to the vllage of hs brth n reland, where he falls for a sprted redhead whose brother s contemptuous of ther unon.;35,645;10,55; R$ 10.550.000,00 
