;name;year;runtme;genre;ratng;metascore;tmelne;votes;base;gross
0;The Shawshank Redempton;1994;142;Drama;9.3;80;Two mprsoned men bond over a number of years, fndng solace and eventual redempton through acts of common decency.;2,394,059;28,34; R$ 28.340.000,00 
1;The Godfather;1972;175;Crme, Drama;9.2;100;An organzed crme dynasty's agng patrarch transfers control of hs clandestne empre to hs reluctant son.;1,658,439;134,97; R$ 134.970.000,00 
3;The Dark Knght;2008;152;Acton, Crme, Drama;9.0;84;When the menace known as the Joker wreaks havoc and chaos on the people of Gotham, Batman must accept one of the greatest psychologcal and physcal tests of hs ablty to fght njustce.;2,355,907;534,86; R$ 534.860.000,00 
4;The Godfather: Part ;1974;202;Crme, Drama;9.0;90;The early lfe and career of Vto Corleone n 1920s New York Cty s portrayed, whle hs son, Mchael, expands and tghtens hs grp on the famly crme syndcate.;1,152,912;57,3; R$ 57.300.000,00 
5;12 Angry Men;1957;96;Crme, Drama;9.0;96;A jury holdout attempts to prevent a mscarrage of justce by forcng hs colleagues to reconsder the evdence.;706,079;4,36; R$ 4.360.000,00 
6;The Lord of the Rngs: The Return of the Kng;2003;201;Acton, Adventure, Drama;8.9;94;Gandalf and Aragorn lead the World of Men aganst Sauron's army to draw hs gaze from Frodo and Sam as they approach Mount Doom wth the One Rng.;1,672,460;377,85; R$ 377.850.000,00 
7;Pulp Fcton;1994;154;Crme, Drama;8.9;94;The lves of two mob htmen, a boxer, a gangster and hs wfe, and a par of dner bandts ntertwne n four tales of volence and redempton.;1,862,472;107,93; R$ 107.930.000,00 
8;Schndler's Lst;1993;195;Bography, Drama, Hstory;8.9;94;n German-occuped Poland durng World War , ndustralst Oskar Schndler gradually becomes concerned for hs Jewsh workforce after wtnessng ther persecuton by the Nazs.;1,236,213;96,9; R$ 96.900.000,00 
9;ncepton;2010;148;Acton, Adventure, Sc-F;8.8;74;A thef who steals corporate secrets through the use of dream-sharng technology s gven the nverse task of plantng an dea nto the mnd of a C.E.O.;2,113,984;292,58; R$ 292.580.000,00 
10;Fght Club;1999;139;Drama;8.8;66;An nsomnac offce worker and a devl-may-care soap maker form an underground fght club that evolves nto much more.;1,892,181;37,03; R$ 37.030.000,00 
11;The Lord of the Rngs: The Fellowshp of the Rng;2001;178;Acton, Adventure, Drama;8.8;92;A meek Hobbt from the Shre and eght companons set out on a journey to destroy the powerful One Rng and save Mddle-earth from the Dark Lord Sauron.;1,693,187;315,54; R$ 315.540.000,00 
12;Forrest Gump;1994;142;Drama, Romance;8.8;82;The presdences of Kennedy and Johnson, the Vetnam War, the Watergate scandal and other hstorcal events unfold from the perspectve of an Alabama man wth an Q of 75, whose only desre s to be reunted wth hs chldhood sweetheart.;1,851,357;330,25; R$ 330.250.000,00 
13;The Good, the Bad and the Ugly;1966;178;Western;8.8;90;A bounty huntng scam jons two men n an uneasy allance aganst a thrd n a race to fnd a fortune n gold bured n a remote cemetery.;700,347;6,1; R$ 6.100.000,00 
14;The Lord of the Rngs: The Two Towers;2002;179;Acton, Adventure, Drama;8.7;87;Whle Frodo and Sam edge closer to Mordor wth the help of the shfty Gollum, the dvded fellowshp makes a stand aganst Sauron's new ally, Saruman, and hs hordes of sengard.;1,512,442;342,55; R$ 342.550.000,00 
15;The Matrx;1999;136;Acton, Sc-F;8.7;73;When a beautful stranger leads computer hacker Neo to a forbddng underworld, he dscovers the shockng truth--the lfe he knows s the elaborate decepton of an evl cyber-ntellgence.;1,710,438;171,48; R$ 171.480.000,00 
16;Goodfellas;1990;146;Bography, Crme, Drama;8.7;90;The story of Henry Hll and hs lfe n the mob, coverng hs relatonshp wth hs wfe Karen Hll and hs mob partners Jmmy Conway and Tommy DeVto n the talan-Amercan crme syndcate.;1,042,578;46,84; R$ 46.840.000,00 
17;Star Wars: Epsode V - The Empre Strkes Back;1980;124;Acton, Adventure, Fantasy;8.7;82;After the Rebels are brutally overpowered by the Empre on the ce planet Hoth, Luke Skywalker begns Jedtranng wth Yoda, whle hs frends are pursued by Darth Vader and a bounty hunter named Boba Fett all over the galaxy.;1,178,844;290,48; R$ 290.480.000,00 
18;One Flew Over the Cuckoo's Nest;1975;133;Drama;8.7;84;A crmnal pleads nsanty and s admtted to a mental nsttuton, where he rebels aganst the oppressve nurse and ralles up the scared patents.;933,318;112; R$ 112.000.000,00 
19;Paraste;2019;132;Comedy, Drama, Thrller;8.6;96;Greed and class dscrmnaton threaten the newly formed symbotc relatonshp between the wealthy Park famly and the desttute Km clan.;608,406;53,37; R$ 53.370.000,00 
20;nterstellar;2014;169;Adventure, Drama, Sc-F;8.6;74;A team of explorers travel through a wormhole n space n an attempt to ensure humanty's survval.;1,558,558;188,02; R$ 188.020.000,00 
21;Cty of God;2002;130;Crme, Drama;8.6;79;n the slums of Ro, two kds' paths dverge as one struggles to become a photographer and the other a kngpn.;709,284;7,56; R$ 7.560.000,00 
22;Sprted Away;2001;125;Anmaton, Adventure, Famly;8.6;96;Durng her famly's move to the suburbs, a sullen 10-year-old grl wanders nto a world ruled by gods, wtches, and sprts, and where humans are changed nto beasts.;670,674;10,06; R$ 10.060.000,00 
23;Savng Prvate Ryan;1998;169;Drama, War;8.6;91;Followng the Normandy Landngs, a group of U.S. solders go behnd enemy lnes to retreve a paratrooper whose brothers have been klled n acton.;1,262,408;216,54; R$ 216.540.000,00 
24;The Green Mle;1999;189;Crme, Drama, Fantasy;8.6;61;The lves of guards on Death Row are affected by one of ther charges: a black man accused of chld murder and rape, yet who has a mysterous gft.;1,173,460;136,8; R$ 136.800.000,00 
25;Lfe s Beautful;1997;116;Comedy, Drama, Romance;8.6;59;When an open-mnded Jewsh lbraran and hs son become vctms of the Holocaust, he uses a perfect mxture of wll, humor, and magnaton to protect hs son from the dangers around ther camp.;636,745;57,6; R$ 57.600.000,00 
26;Se7en;1995;127;Crme, Drama, Mystery;8.6;65;Two detectves, a rooke and a veteran, hunt a seral kller who uses the seven deadly sns as hs motves.;1,477,013;100,13; R$ 100.130.000,00 
27;The Slence of the Lambs;1991;118;Crme, Drama, Thrller;8.6;85;A young F.B.. cadet must receve the help of an ncarcerated and manpulatve cannbal kller to help catch another seral kller, a madman who skns hs vctms.;1,298,483;130,74; R$ 130.740.000,00 
28;Star Wars: Epsode V - A New Hope;1977;121;Acton, Adventure, Fantasy;8.6;90;Luke Skywalker jons forces wth a JedKnght, a cocky plot, a Wookee and two drods to save the galaxy from the Empre's world-destroyng battle staton, whle also attemptng to rescue Prncess Lea from the mysterous Darth Vader.;1,250,920;322,74; R$ 322.740.000,00 
30;Seven Samura;1954;207;Acton, Adventure, Drama;8.6;98;A poor vllage under attack by bandts recruts seven unemployed samurato help them defend themselves.;321,308;0,27; R$ 270.000,00 
34;Whplash;2014;106;Drama, Musc;8.5;88;A promsng young drummer enrolls at a cut-throat musc conservatory where hs dreams of greatness are mentored by an nstructor who wll stop at nothng to realze a student's potental.;738,672;13,09; R$ 13.090.000,00 
35;The ntouchables;2011;112;Bography, Comedy, Drama;8.5;57;After he becomes a quadrplegc from a paragldng accdent, an arstocrat hres a young man from the projects to be hs caregver.;778,379;13,18; R$ 13.180.000,00 
36;The Prestge;2006;130;Drama, Mystery, Sc-F;8.5;66;After a tragc accdent, two stage magcans engage n a battle to create the ultmate lluson whle sacrfcng everythng they have to outwt each other.;1,215,602;53,09; R$ 53.090.000,00 
37;The Departed;2006;151;Crme, Drama, Thrller;8.5;85;An undercover cop and a mole n the polce attempt to dentfy each other whle nfltratng an rsh gang n South Boston.;1,212,956;132,38; R$ 132.380.000,00 
38;The Panst;2002;150;Bography, Drama, Musc;8.5;85;A Polsh Jewsh muscan struggles to survve the destructon of the Warsaw ghetto of World War .;748,697;32,57; R$ 32.570.000,00 
39;Gladator;2000;155;Acton, Adventure, Drama;8.5;67;A former Roman General sets out to exact vengeance aganst the corrupt emperor who murdered hs famly and sent hm nto slavery.;1,366,190;187,71; R$ 187.710.000,00 
40;Amercan Hstory X;1998;119;Drama;8.5;62;A former neo-nazsknhead tres to prevent hs younger brother from gong down the same wrong path that he dd.;1,049,308;6,72; R$ 6.720.000,00 
41;The Usual Suspects;1995;106;Crme, Mystery, Thrller;8.5;77;A sole survvor tells of the twsty events leadng up to a horrfc gun battle on a boat, whch began when fve crmnals met at a seemngly random polce lneup.;1,007,527;23,34; R$ 23.340.000,00 
42;Léon: The Professonal;1994;110;Acton, Crme, Drama;8.5;64;Mathlda, a 12-year-old grl, s reluctantly taken n by Léon, a professonal assassn, after her famly s murdered. An unusual relatonshp forms as she becomes hs protégée and learns the assassn's trade.;1,056,159;19,5; R$ 19.500.000,00 
43;The Lon Kng;1994;88;Anmaton, Adventure, Drama;8.5;88;Lon prnce Smba and hs father are targeted by hs btter uncle, who wants to ascend the throne hmself.;961,309;422,78; R$ 422.780.000,00 
44;Termnator 2: Judgment Day;1991;137;Acton, Sc-F;8.5;75;A cyborg, dentcal to the one who faled to kll Sarah Connor, must now protect her ten year old son, John Connor, from a more advanced and powerful cyborg.;1,010,778;204,84; R$ 204.840.000,00 
45;Cnema Paradso;1988;155;Drama, Romance;8.5;80;A flmmaker recalls hs chldhood when fallng n love wth the pctures at the cnema of hs home vllage and forms a deep frendshp wth the cnema's projectonst.;236,441;11,99; R$ 11.990.000,00 
47;Back to the Future;1985;116;Adventure, Comedy, Sc-F;8.5;87;Marty McFly, a 17-year-old hgh school student, s accdentally sent thrty years nto the past n a tme-travelng DeLorean nvented by hs close frend, the eccentrc scentst Doc Brown.;1,081,797;210,61; R$ 210.610.000,00 
48;Once Upon a Tme n the West;1968;165;Western;8.5;80;A mysterous stranger wth a harmonca jons forces wth a notorous desperado to protect a beautful wdow from a ruthless assassn workng for the ralroad.;307,736;5,32; R$ 5.320.000,00 
49;Psycho;1960;109;Horror, Mystery, Thrller;8.5;97;A Phoenx secretary embezzles 40,000 from her employer's clent, goes on the run, and checks nto a remote motel run by a young man under the domnaton of hs mother.;615,511;32; R$ 32.000.000,00 
50;Rear Wndow;1954;112;Mystery, Thrller;8.5;100;A wheelchar-bound photographer spes on hs neghbors from hs apartment wndow and becomes convnced one of them has commtted murder.;452,067;36,76; R$ 36.760.000,00 
51;Casablanca;1942;102;Drama, Romance, War;8.5;100;A cyncal expatrate Amercan cafe owner struggles to decde whether or not to help hs former lover and her fugtve husband escape the Nazs n French Morocco.;530,4;1,02; R$ 1.020.000,00 
52;Modern Tmes;1936;87;Comedy, Drama, Famly;8.5;96;The Tramp struggles to lve n modern ndustral socety wth the help of a young homeless woman.;222,623;0,16; R$ 160.000,00 
53;Cty Lghts;1931;87;Comedy, Drama, Romance;8.5;99;Wth the ad of a wealthy erratc tppler, a dewy-eyed tramp who has fallen n love wth a sghtless flower grl accumulates money to be able to help her medcally.;171,097;0,02; R$ 20.000,00 
54;Capharnaüm;2018;126;Drama;8.4;75;Whle servng a fve-year sentence for a volent crme, a 12-year-old boy sues hs parents for neglect.;68,968;1,66; R$ 1.660.000,00 
55;Joker;2019;122;Crme, Drama, Thrller;8.4;59;n Gotham Cty, mentally troubled comedan Arthur Fleck s dsregarded and mstreated by socety. He then embarks on a downward spral of revoluton and bloody crme. Ths path brngs hm face-to-face wth hs alter-ego: the Joker.;998,809;335,45; R$ 335.450.000,00 
58;Your Name.;2016;106;Anmaton, Drama, Fantasy;8.4;79;Two strangers fnd themselves lnked n a bzarre way. When a connecton forms, wll dstance be the only thng to keep them apart?;208,863;5,02; R$ 5.020.000,00 
59;Dangal;2016;161;Acton, Bography, Drama;8.4;;Former wrestler Mahavr Sngh Phogat and hs two wrestler daughters struggle towards glory at the Commonwealth Games n the face of socetal oppresson.;163,336;12,39; R$ 12.390.000,00 
60;Spder-Man: nto the Spder-Verse;2018;117;Anmaton, Acton, Adventure;8.4;87;Teen Mles Morales becomes the Spder-Man of hs unverse, and must jon wth fve spder-powered ndvduals from other dmensons to stop a threat for all realtes.;400;190,24; R$ 190.240.000,00 
61;Avengers: Endgame;2019;181;Acton, Adventure, Drama;8.4;78;After the devastatng events of Avengers: nfnty War (2018), the unverse s n runs. Wth the help of remanng alles, the Avengers assemble once more n order to reverse Thanos' actons and restore balance to the unverse.;874,948;858,37; R$ 858.370.000,00 
62;Avengers: nfnty War;2018;149;Acton, Adventure, Sc-F;8.4;68;The Avengers and ther alles must be wllng to sacrfce all n an attempt to defeat the powerful Thanos before hs bltz of devastaton and run puts an end to the unverse.;877,735;678,82; R$ 678.820.000,00 
63;Coco;2017;105;Anmaton, Adventure, Drama;8.4;81;Asprng muscan Mguel, confronted wth hs famly's ancestral ban on musc, enters the Land of the Dead to fnd hs great-great-grandfather, a legendary snger.;405,773;209,73; R$ 209.730.000,00 
64;Django Unchaned;2012;165;Drama, Western;8.4;81;Wth the help of a German bounty-hunter, a freed slave sets out to rescue hs wfe from a brutal plantaton-owner n Msssspp.;1,388,935;162,81; R$ 162.810.000,00 
65;The Dark Knght Rses;2012;164;Acton, Adventure;8.4;78;Eght years after the Joker's regn of anarchy, Batman, wth the help of the engmatc Catwoman, s forced from hs exle to save Gotham Cty from the brutal guerrlla terrorst Bane.;1,545,023;448,14; R$ 448.140.000,00 
66;3 dots;2009;170;Comedy, Drama;8.4;67;"Two frends are searchng for ther long lost companon. They revst ther college days and recall the memores of ther frend who nspred them to thnk dfferently, even as the rest of the world called them ""dots"".";354,804;6,53; R$ 6.530.000,00 
67;Lke Stars on Earth;2007;165;Drama, Famly;8.4;;An eght-year-old boy s thought to be a lazy trouble-maker, untl the new art teacher has the patence and compasson to dscover the real problem behnd hs struggles n school.;174,528;1,22; R$ 1.220.000,00 
68;WALL·E;2008;98;Anmaton, Adventure, Famly;8.4;95;n the dstant future, a small waste-collectng robot nadvertently embarks on a space journey that wll ultmately decde the fate of manknd.;1,019,165;223,81; R$ 223.810.000,00 
69;The Lves of Others;2006;137;Drama, Mystery, Thrller;8.4;89;n 1984 East Berln, an agent of the secret polce, conductng survellance on a wrter and hs lover, fnds hmself becomng ncreasngly absorbed by ther lves.;365,313;11,29; R$ 11.290.000,00 
70;Oldboy;2003;120;Acton, Drama, Mystery;8.4;77;After beng kdnapped and mprsoned for ffteen years, Oh Dae-Su s released, only to fnd that he must fnd hs captor n fve days.;526,864;0,71; R$ 710.000,00 
71;Memento;2000;113;Mystery, Thrller;8.4;80;A man wth short-term memory loss attempts to track down hs wfe's murderer.;1,144,823;25,54; R$ 25.540.000,00 
72;Prncess Mononoke;1997;134;Anmaton, Acton, Adventure;8.4;76;On a journey to fnd the cure for a Tatargam's curse, Ashtaka fnds hmself n the mddle of a war between the forest gods and Tatara, a mnng colony. n ths quest he also meets San, the Mononoke Hme.;352,513;2,38; R$ 2.380.000,00 
73;Once Upon a Tme n Amerca;1984;229;Crme, Drama;8.4;;A former Prohbton-era Jewsh gangster returns to the Lower East Sde of Manhattan over thrty years later, where he once agan must confront the ghosts and regrets of hs old lfe.;318,184;5,32; R$ 5.320.000,00 
74;ndana Jones and the Raders of the Lost Ark;1981;115;Acton, Adventure;8.4;85;n 1936, archaeologst and adventurer ndana Jones s hred by the U.S. government to fnd the Ark of the Covenant before Adolf Htler's Nazs can obtan ts awesome powers.;897,322;248,16; R$ 248.160.000,00 
75;The Shnng;1980;146;Drama, Horror;8.4;66;A famly heads to an solated hotel for the wnter where a snster presence nfluences the father nto volence, whle hs psychc son sees horrfc forebodngs from both past and future.;917,316;44,02; R$ 44.020.000,00 
76;Apocalypse Now;1979;147;Drama, Mystery, War;8.4;94;A U.S. Army offcer servng n Vetnam s tasked wth assassnatng a renegade Specal Forces Colonel who sees hmself as a god.;617,196;83,47; R$ 83.470.000,00 
77;Alen;1979;117;Horror, Sc-F;8.4;89;After a space merchant vessel receves an unknown transmsson as a dstress call, one of the crew s attacked by a mysterous lfe form and they soon realze that ts lfe cycle has merely begun.;802,9;78,9; R$ 78.900.000,00 
79;Dr. Strangelove or: How Learned to Stop Worryng and Love the Bomb;1964;95;Comedy;8.4;97;An nsane general trggers a path to nuclear holocaust that a War Room full of poltcans and generals frantcally tres to stop.;457,287;0,28; R$ 280.000,00 
80;Wtness for the Prosecuton;1957;116;Crme, Drama, Mystery;8.4;;A veteran Brtsh barrster must defend hs clent n a murder tral that has surprse after surprse.;111,853;8,18; R$ 8.180.000,00 
83;The Great Dctator;1940;125;Comedy, Drama, War;8.4;;Dctator Adenod Hynkel tres to expand hs empre whle a poor Jewsh barber tres to avod persecuton from Hynkel's regme.;206,839;0,29; R$ 290.000,00 
84;Chhchhore;2019;143;Comedy, Drama;8.3;;A tragc ncdent forces Anrudh, a mddle-aged man, to take a trp down memory lane and remnsce hs college days along wth hs frends, who were labelled as losers.;37,268;0,9; R$ 900.000,00 
85;1917;2019;119;Drama, Thrller, War;8.3;78;Aprl 6th, 1917. As a regment assembles to wage war deep n enemy terrtory, two solders are assgned to race aganst tme and delver a message that wll stop 1,600 men from walkng straght nto a deadly trap.;460,797;159,23; R$ 159.230.000,00 
88;The Hunt;2012;115;Drama;8.3;77;A teacher lves a lonely lfe, all the whle strugglng over hs son's custody. Hs lfe slowly gets better as he fnds love and receves good news from hs son, but hs new luck s about to be brutally shattered by an nnocent lttle le.;292,306;0,69; R$ 690.000,00 
89;A Separaton;2011;123;Drama;8.3;95;A marred couple are faced wth a dffcult decson - to mprove the lfe of ther chld by movng to another country or to stay n ran and look after a deteroratng parent who has Alzhemer's dsease.;225,106;7,1; R$ 7.100.000,00 
90;ncendes;2010;131;Drama, Mystery, War;8.3;80;Twns journey to the Mddle East to dscover ther famly hstory and fulfll ther mother's last wshes.;155,335;6,86; R$ 6.860.000,00 
94;nglourous Basterds;2009;153;Adventure, Drama, War;8.3;69;n Naz-occuped France durng World War , a plan to assassnate Nazleaders by a group of Jewsh U.S. solders concdes wth a theatre owner's vengeful plans for the same.;1,297,579;120,54; R$ 120.540.000,00 
95;Eternal Sunshne of the Spotless Mnd;2004;108;Drama, Romance, Sc-F;8.3;89;When ther relatonshp turns sour, a couple undergoes a medcal procedure to have each other erased from ther memores.;927,213;34,4; R$ 34.400.000,00 
96;Améle;2001;122;Comedy, Romance;8.3;69;Améle s an nnocent and nave grl n Pars wth her own sense of justce. She decdes to help those around her and, along the way, dscovers love.;713,537;33,23; R$ 33.230.000,00 
97;Snatch;2000;102;Comedy, Crme;8.3;55;Unscrupulous boxng promoters, volent bookmakers, a Russan gangster, ncompetent amateur robbers and supposedly Jewsh jewelers fght to track down a prceless stolen damond.;794,366;30,33; R$ 30.330.000,00 
98;Requem for a Dream;2000;102;Drama;8.3;68;The drug-nduced utopas of four Coney sland people are shattered when ther addctons run deep.;779,993;3,64; R$ 3.640.000,00 
99;Amercan Beauty;1999;122;Drama;8.3;84;A sexually frustrated suburban father has a md-lfe crss after becomng nfatuated wth hs daughter's best frend.;1,084,775;130,1; R$ 130.100.000,00 
100;Good Wll Huntng;1997;126;Drama, Romance;8.3;70;Wll Huntng, a jantor at M..T., has a gft for mathematcs, but needs help from a psychologst to fnd drecton n hs lfe.;879,683;138,43; R$ 138.430.000,00 
101;Chldren of Heaven;1997;89;Drama, Famly, Sport;8.3;77;"After a boy loses hs sster's par of shoes, he goes on a seres of adventures n order to fnd them. When he can't, he tres a new way to ""wn"" a new par.";67,349;0,93; R$ 930.000,00 
102;Toy Story;1995;81;Anmaton, Adventure, Comedy;8.3;95;A cowboy doll s profoundly threatened and jealous when a new spaceman fgure supplants hm as top toy n a boy's room.;904,659;191,8; R$ 191.800.000,00 
103;Braveheart;1995;178;Bography, Drama, Hstory;8.3;68;Scottsh warror Wllam Wallace leads hs countrymen n a rebellon to free hs homeland from the tyranny of Kng Edward of England.;972,846;75,6; R$ 75.600.000,00 
104;Reservor Dogs;1992;99;Crme, Drama, Thrller;8.3;79;When a smple jewelry hest goes horrbly wrong, the survvng crmnals begn to suspect that one of them s a polce nformant.;935,555;2,83; R$ 2.830.000,00 
105;Full Metal Jacket;1987;116;Drama, War;8.3;76;A pragmatc U.S. Marne observes the dehumanzng effects the Vetnam War has on hs fellow recruts from ther brutal boot camp tranng to the bloody street fghtng n Hue.;686,189;46,36; R$ 46.360.000,00 
107;Alens;1986;137;Acton, Adventure, Sc-F;8.3;84;Ffty-seven years after survvng an apocalyptc attack aboard her space vessel by mercless space creatures, Offcer Rpley awakens from hyper-sleep and tres to warn anyone who wll lsten about the predators.;662,821;85,16; R$ 85.160.000,00 
108;Amadeus;1984;160;Bography, Drama, Hstory;8.3;88;The lfe, success and troubles of Wolfgang Amadeus Mozart, as told by Antono Saler, the contemporaneous composer who was nsanely jealous of Mozart's talent and clamed to have murdered hm.;374,88;51,97; R$ 51.970.000,00 
109;Scarface;1983;170;Crme, Drama;8.3;65;n 1980 Mam, a determned Cuban mmgrant takes over a drug cartel and succumbs to greed.;758,287;45,6; R$ 45.600.000,00 
110;Star Wars: Epsode V- Return of the Jed;1983;131;Acton, Adventure, Fantasy;8.3;58;After a darng msson to rescue Han Solo from Jabba the Hutt, the Rebels dspatch to Endor to destroy the second Death Star. Meanwhle, Luke struggles to help Darth Vader back from the dark sde wthout fallng nto the Emperor's trap.;966,109;309,13; R$ 309.130.000,00 
112;TaxDrver;1976;114;Crme, Drama;8.3;94;A mentally unstable veteran works as a nghttme taxdrver n New York Cty, where the perceved decadence and sleaze fuels hs urge for volent acton by attemptng to lberate a presdental campagn worker and an underage prosttute.;740,978;28,26; R$ 28.260.000,00 
113;The Stng;1973;129;Comedy, Crme, Drama;8.3;83;Two grfters team up to pull off the ultmate con.;245,333;159,6; R$ 159.600.000,00 
114;A Clockwork Orange;1971;136;Crme, Drama, Sc-F;8.3;77;n the future, a sadstc gang leader s mprsoned and volunteers for a conduct-averson experment, but t doesn't go as planned.;769,687;6,21; R$ 6.210.000,00 
116;2001: A Space Odyssey;1968;149;Adventure, Sc-F;8.3;84;After dscoverng a mysterous artfact bured beneath the Lunar surface, manknd sets off on a quest to fnd ts orgns wth help from ntellgent supercomputer H.A.L. 9000.;614,397;56,95; R$ 56.950.000,00 
118;Lawrence of Araba;1962;228;Adventure, Bography, Drama;8.3;100;The story of T.E. Lawrence, the Englsh offcer who successfully unted and led the dverse, often warrng, Arab trbes durng World War n order to fght the Turks.;272,61;44,82; R$ 44.820.000,00 
119;The Apartment;1960;125;Comedy, Drama, Romance;8.3;94;A man tres to rse n hs company by lettng ts executves use hs apartment for trysts, but complcatons and a romance of hs own ensue.;167,535;18,6; R$ 18.600.000,00 
120;North by Northwest;1959;136;Adventure, Mystery, Thrller;8.3;98;A New York Cty advertsng executve goes on the run after beng mstaken for a government agent by a group of foregn spes.;303,834;13,28; R$ 13.280.000,00 
121;Vertgo;1958;128;Mystery, Romance, Thrller;8.3;100;A former polce detectve juggles wrestlng wth hs personal demons and becomng obsessed wth a hauntngly beautful woman.;371,271;3,2; R$ 3.200.000,00 
122;Sngn' n the Ran;1952;103;Comedy, Muscal, Romance;8.3;99;A slent flm producton company and cast make a dffcult transton to sound.;222,996;8,82; R$ 8.820.000,00 
123;kru;1952;143;Drama;8.3;;A bureaucrat tres to fnd a meanng n hs lfe after he dscovers he has termnal cancer.;70,514;0,06; R$ 60.000,00 
124;Bcycle Theves;1948;89;Drama;8.3;;n post-war taly, a workng-class man's bcycle s stolen. He and hs son set out to fnd t.;149,923;0,33; R$ 330.000,00 
125;Double ndemnty;1944;107;Crme, Drama, Flm-Nor;8.3;95;An nsurance representatve lets hmself be talked by a seductve housewfe nto a murder/nsurance fraud scheme that arouses the suspcon of an nsurance nvestgator.;146,157;5,72; R$ 5.720.000,00 
127;M;1931;99;Crme, Mystery, Thrller;8.3;;When the polce n a German cty are unable to catch a chld-murderer, other crmnals jon n the manhunt.;146,268;0,03; R$ 30.000,00 
128;Metropols;1927;153;Drama, Sc-F;8.3;98;n a futurstc cty sharply dvded between the workng class and the cty planners, the son of the cty's mastermnd falls n love wth a workng-class prophet who predcts the comng of a savor to medate ther dfferences.;162,702;1,24; R$ 1.240.000,00 
129;The Kd;1921;68;Comedy, Drama, Famly;8.3;;The Tramp cares for an abandoned chld, but events put that relatonshp n jeopardy.;116,234;5,45; R$ 5.450.000,00 
130;Ur: The Surgcal Strke;2018;138;Acton, Drama, War;8.2;;ndan army specal forces execute a covert operaton, avengng the kllng of fellow army men at ther base by a terrorst group.;45,165;4,19; R$ 4.190.000,00 
131;Andhadhun;2018;139;Crme, Drama, Musc;8.2;;A seres of mysterous events change the lfe of a blnd panst, who must now report a crme that he should techncally know nothng of.;76,567;1,37; R$ 1.370.000,00 
133;Green Book;2018;130;Bography, Comedy, Drama;8.2;69;A workng-class talan-Amercan bouncer becomes the drver of an Afrcan-Amercan classcal panst on a tour of venues through the 1960s Amercan South.;404,395;85,08; R$ 85.080.000,00 
