;name;year;runtme;genre;ratng;metascore;tmelne;votes;base;gross
277;The Thng;1982;109;Horror, Mystery, Sc-F;8.1;57;A research team n Antarctca s hunted by a shape-shftng alen that assumes the appearance of ts vctms.;378,486;13,78; R$ 13.780.000,00 
279;Fanny and Alexander;1982;188;Drama;8.1;100;Two young Swedsh chldren experence the many comedes and tragedes of ther famly, the Ekdahls.;58,6;4,97; R$ 4.970.000,00 
280;Blade Runner;1982;117;Acton, Sc-F, Thrller;8.1;84;A blade runner must pursue and termnate four replcants who stole a shp n space, and have returned to Earth to fnd ther creator.;705,277;32,87; R$ 32.870.000,00 
282;Stalker;1979;162;Drama, Sc-F;8.1;;A gude leads two men through an area known as the Zone to fnd a room that grants wshes.;120,293;0,23; R$ 230.000,00 
283;Monty Python's Lfe of Bran;1979;94;Comedy;8.1;77;Born on the orgnal Chrstmas n the stable next door to Jesus Chrst, Bran of Nazareth spends hs lfe beng mstaken for a messah.;373,225;20,05; R$ 20.050.000,00 
284;The Deer Hunter;1978;183;Drama, War;8.1;86;An n-depth examnaton of the ways n whch the U.S. Vetnam War mpacts and dsrupts the lves of people n a small ndustral town n Pennsylvana.;316,679;48,98; R$ 48.980.000,00 
285;Rocky;1976;120;Drama, Sport;8.1;70;A small-tme boxer gets a supremely rare chance to fght a heavyweght champon n a bout n whch he strves to go the dstance for hs self-respect.;528,291;117,24; R$ 117.240.000,00 
288;Mrror;1975;107;Bography, Drama;8.1;80;A dyng man n hs fortes remembers hs past. Hs chldhood, hs mother, the war, personal moments and thngs that tell of the recent hstory of all the Russan naton.;41,222;0,18; R$ 180.000,00 
289;Paper Moon;1973;102;Comedy, Crme, Drama;8.1;77;Durng the Great Depresson, a con man fnds hmself saddled wth a young grl who may or may not be hs daughter, and the two forge an unlkely partnershp.;43,026;30,93; R$ 30.930.000,00 
290;Cres & Whspers;1972;91;Drama;8.1;;When a woman dyng of cancer n early twenteth-century Sweden s vsted by her two ssters, long-repressed feelngs between the sblngs rse to the surface.;31,001;1,74; R$ 1.740.000,00 
292;Le Samouraï;1967;101;Crme, Drama, Mystery;8.1;;After professonal htman Jef Costello s seen by wtnesses hs efforts to provde hmself an albdrve hm further nto a corner.;46,659;0,04; R$ 40.000,00 
293;Cool Hand Luke;1967;127;Crme, Drama;8.1;92;A lad back Southern man s sentenced to two years n a rural prson, but refuses to conform.;164,764;16,22; R$ 16.220.000,00 
295;AndreRublev;1966;205;Bography, Drama, Hstory;8.1;;The lfe, tmes and afflctons of the ffteenth-century Russan conographer St. AndreRublev.;48,486;0,1; R$ 100.000,00 
296;The Battle of Algers;1966;121;Drama, War;8.1;96;n the 1950s, fear and volence escalate as the people of Algers fght for ndependence from the French government.;54,532;0,06; R$ 60.000,00 
298;What Ever Happened to Baby Jane?;1962;134;Drama, Horror, Thrller;8.1;75;A former chld star torments her paraplegc sster n ther decayng Hollywood manson.;51,229;4,05; R$ 4.050.000,00 
302;The Vrgn Sprng;1960;89;Drama;8.1;;An nnocent yet pampered young vrgn and her famly's pregnant and jealous servant set out to delver candles to church, but only one returns from events that transpre n the woods along the way.;27,225;1,53; R$ 1.530.000,00 
305;Ben-Hur;1959;212;Adventure, Drama, Hstory;8.1;90;After a Jewsh prnce s betrayed and sent nto slavery by a Roman frend, he regans hs freedom and comes back for revenge.;222,916;74,7; R$ 74.700.000,00 
307;Nghts of Cabra;1957;110;Drama;8.1;;A wafsh prosttute wanders the streets of Rome lookng for true love but fnds only heartbreak.;43,914;0,75; R$ 750.000,00 
309;The Brdge on the Rver Kwa;1957;161;Adventure, Drama, War;8.1;87;Brtsh POWs are forced to buld a ralway brdge across the rver Kwafor ther Japanese captors, not knowng that the alled forces are plannng to destroy t.;206,62;44,91; R$ 44.910.000,00 
310;Rff;1955;118;Crme, Drama, Thrller;8.1;97;Four men plan a techncally perfect crme, but the human element ntervenes...;30,468;0,06; R$ 60.000,00 
311;On the Waterfront;1954;108;Crme, Drama, Thrller;8.1;91;An ex-prze fghter turned longshoreman struggles to stand up to hs corrupt unon bosses.;144,545;9,6; R$ 9.600.000,00 
314;Ace n the Hole;1951;111;Drama, Flm-Nor;8.1;72;A frustrated former bg-cty journalst now stuck workng for an Albuquerque newspaper explots a story about a man trapped n a cave to rekndle hs career, but the stuaton quckly escalates nto an out-of-control crcus.;32,355;3,97; R$ 3.970.000,00 
316;The Thrd Man;1949;93;Flm-Nor, Mystery, Thrller;8.1;97;Pulp novelst Holly Martns travels to shadowy, postwar Venna, only to fnd hmself nvestgatng the mysterous death of an old frend, Harry Lme.;161,382;0,45; R$ 450.000,00 
317;The Red Shoes;1948;135;Drama, Musc, Romance;8.1;;A young ballet dancer s torn between the man she loves and her pursut to become a prma ballerna.;31,696;10,9; R$ 10.900.000,00 
318;The Best Years of Our Lves;1946;170;Drama, Romance, War;8.1;93;Three World War veterans return home to small-town Amerca to dscover that they and ther famles have been rreparably changed.;58,085;23,65; R$ 23.650.000,00 
319;The Shop Around the Corner;1940;99;Comedy, Drama, Romance;8.1;96;Two employees at a gft shop can barely stand each other, wthout realzng that they are fallng n love through the post as each other's anonymous pen pal.;29,068;0,2; R$ 200.000,00 
320;Rebecca;1940;130;Drama, Mystery, Romance;8.1;86;A self-conscous woman juggles adjustng to her new role as an arstocrat's wfe and avodng beng ntmdated by hs frst wfe's spectral presence.;126,374;4,36; R$ 4.360.000,00 
321;The Grapes of Wrath;1940;129;Drama, Hstory;8.1;96;A poor Mdwest famly s forced off ther land. They travel to Calforna, sufferng the msfortunes of the homeless n the Great Depresson.;86,466;0,06; R$ 60.000,00 
322;Mr. Smth Goes to Washngton;1939;129;Comedy, Drama;8.1;73;A nave man s apponted to fll a vacancy n the Unted States Senate. Hs plans promptly collde wth poltcal corrupton, but he doesn't back down.;108,683;9,6; R$ 9.600.000,00 
323;Gone wth the Wnd;1939;238;Drama, Hstory, Romance;8.1;97;A manpulatve woman and a rogush man conduct a turbulent romance durng the Amercan Cvl War and Reconstructon perods.;294,524;198,68; R$ 198.680.000,00 
324;La Grande lluson;1937;113;Drama, War;8.1;;Durng WW, two French solders are captured and mprsoned n a German P.O.W. camp. Several escape attempts follow untl they are eventually sent to a seemngly nescapable fortress.;34,345;0,17; R$ 170.000,00 
325;t Happened One Nght;1934;105;Comedy, Romance;8.1;87;A renegade reporter and a crazy young heress meet on a bus headng for New York, and end up stuck wth each other when the bus leaves them behnd at one of the stops.;95,974;4,36; R$ 4.360.000,00 
326;All Quet on the Western Front;1930;152;Drama, War;8.1;91;A German youth eagerly enters World War , but hs enthusasm wanes as he gets a frsthand vew of the horror.;57,948;3,27; R$ 3.270.000,00 
327;The Passon of Joan of Arc;1928;114;Bography, Drama, Hstory;8.1;;n 1431, Jeanne d'Arc s placed on tral on charges of heresy. The ecclesastcal jursts attempt to force Jeanne to recant her clams of holy vsons.;49,078;0,02; R$ 20.000,00 
329;Sunrse;1927;94;Drama, Romance;8.1;;A sophstcated urban woman seduces a farmer n the hopes that he wll murder hs neglected wfe and jon her n the cty, but he soon fnds hmself rekndlng hs romance wth the latter when she dscovers ther scheme.;47,546;0,54; R$ 540.000,00 
330;The General;1926;67;Acton, Adventure, Comedy;8.1;;When Unon spes steal an engneer's beloved locomotve, he pursues t sngle-handedly and straght through enemy lnes.;82,714;1,03; R$ 1.030.000,00 
335;BajrangBhajaan;2015;163;Acton, Adventure, Comedy;8.0;;An ndan man wth a magnanmous heart takes a young mute Pakstangrl back to her homeland to reunte her wth her famly.;76,767;8,18; R$ 8.180.000,00 
337;La La Land;2016;128;Comedy, Drama, Musc;8.0;94;Whle navgatng ther careers n Los Angeles, a panst and an actress fall n love whle attemptng to reconcle ther aspratons for the future.;520,132;151,1; R$ 151.100.000,00 
338;Lon;2016;118;Bography, Drama;8.0;69;A fve-year-old ndan boy s adopted by an Australan couple after gettng lost hundreds of klometers from home. 25 years later, he sets out to fnd hs lost famly.;219,563;51,74; R$ 51.740.000,00 
339;The Martan;2015;144;Adventure, Drama, Sc-F;8.0;80;An astronaut becomes stranded on Mars after hs team assume hm dead, and must rely on hs ngenuty to fnd a way to sgnal to Earth that he s alve.;775,936;228,43; R$ 228.430.000,00 
340;Zootopa;2016;108;Anmaton, Adventure, Comedy;8.0;78;n a cty of anthropomorphc anmals, a rooke bunny cop and a cyncal con artst fox must work together to uncover a conspracy.;444,288;341,27; R$ 341.270.000,00 
341;Baahubal: The Begnnng;2015;159;Acton, Drama;8.0;;n ancent nda, an adventurous and darng man becomes nvolved n a decades-old feud between two warrng peoples.;105,329;6,74; R$ 6.740.000,00 
342;The Tale of The Prncess Kaguya;2013;137;Anmaton, Adventure, Drama;8.0;89;Found nsde a shnng stalk of bamboo by an old bamboo cutter and hs wfe, a tny grl grows rapdly nto an exquste young lady. The mysterous young prncess enthralls all who encounter her, but ultmately she must confront her fate, the punshment for her crme.;40,482;1,51; R$ 1.510.000,00 
343;Wonder;2017;113;Drama, Famly;8.0;66;Based on the New York Tmes bestseller, ths move tells the ncredbly nsprng and heartwarmng story of August Pullman, a boy wth facal dfferences who enters the ffth grade, attendng a manstream elementary school for the frst tme.;147,185;132,42; R$ 132.420.000,00 
344;Gully Boy;2019;154;Drama, Musc, Romance;8.0;65;A comng-of-age story based on the lves of street rappers n Mumba.;33,419;5,57; R$ 5.570.000,00 
345;Specal 26;2013;144;Crme, Drama, Thrller;8.0;;A gang of con-men rob promnent rch busnessmen and poltcans by posng as C.B.and ncome tax offcers.;52,007;1,08; R$ 1.080.000,00 
346;Short Term 12;2013;96;Drama;8.0;82;A 20-somethng supervsng staff member of a resdental treatment faclty navgates the troubled waters of that world alongsde her co-worker and longtme boyfrend.;83,287;1,01; R$ 1.010.000,00 
347;The Rad 2;2014;150;Acton, Crme, Thrller;8.0;71;Only a short tme after the frst rad, Rama goes undercover wth the thugs of Jakarta and plans to brng down the syndcate and uncover the corrupton wthn hs polce force.;116,02;2,63; R$ 2.630.000,00 
348;The mtaton Game;2014;114;Bography, Drama, Thrller;8.0;73;Durng World War , the Englsh mathematcal genus Alan Turng tres to crack the German Engma code wth help from fellow mathematcans.;699,734;91,13; R$ 91.130.000,00 
349;Guardans of the Galaxy;2014;121;Acton, Adventure, Comedy;8.0;76;A group of ntergalactc crmnals must pull together to stop a fanatcal warror wth plans to purge the unverse.;1,064,107;333,18; R$ 333.180.000,00 
350;Blade Runner 2049;2017;164;Acton, Drama, Mystery;8.0;81;Young Blade Runner K's dscovery of a long-bured secret leads hm to track down former Blade Runner Rck Deckard, who's been mssng for thrty years.;478,552;92,05; R$ 92.050.000,00 
351;Her;2013;126;Drama, Romance, Sc-F;8.0;90;n a near future, a lonely wrter develops an unlkely relatonshp wth an operatng system desgned to meet hs every need.;553,466;25,57; R$ 25.570.000,00 
352;The Revenant;2015;156;Acton, Adventure, Drama;8.0;76;A frontersman on a fur tradng expedton n the 1820s fghts for survval after beng mauled by a bear and left for dead by members of hs own huntng team.;721,743;183,64; R$ 183.640.000,00 
353;The Perks of Beng a Wallflower;2012;103;Drama, Romance;8.0;67;An ntrovert freshman s taken under the wngs of two senors who welcome hm to the real world.;471,055;17,74; R$ 17.740.000,00 
354;Elte Squad 2: The Enemy Wthn;2010;115;Acton, Crme, Drama;8.0;71;After a prson rot, former-Captan Nascmento, now a hgh rankng securty offcer n Ro de Janero, s swept nto a bloody poltcal dspute that nvolves government offcals and paramltary groups.;80,014;0,1; R$ 100.000,00 
355;The Kng's Speech;2010;118;Bography, Drama, Hstory;8.0;88;The story of Kng George V, hs mpromptu ascenson to the throne of the Brtsh Empre n 1936, and the speech therapst who helped the unsure monarch overcome hs stammer.;648,093;138,8; R$ 138.800.000,00 
356;The Help;2011;146;Drama;8.0;62;An asprng author durng the cvl rghts movement of the 1960s decdes to wrte a book detalng the Afrcan Amercan mads' pont of vew on the whte famles for whch they work, and the hardshps they go through on a daly bass.;434,099;169,71; R$ 169.710.000,00 
357;Deadpool;2016;108;Acton, Adventure, Comedy;8.0;65;A wsecrackng mercenary gets expermented on and becomes mmortal but ugly, and sets out to track down the man who runed hs looks.;921,991;363,07; R$ 363.070.000,00 
358;Darbareye Elly;2009;119;Drama, Mystery;8.0;87;The mysterous dsappearance of a kndergarten teacher durng a pcnc n the north of ran s followed by a seres of msadventures for her fellow travelers.;47,284;0,11; R$ 110.000,00 
359;Dev.D;2009;144;Drama, Romance;8.0;;After breakng up wth hs chldhood sweetheart, a young man fnds solace n drugs. Meanwhle, a teenage grl s caught n the world of prosttuton. Wll they be destroyed, or wll they fnd redempton?;29,142;0,01; R$ 10.000,00 
361;My Name s Khan;2010;165;Drama;8.0;50;An ndan Muslm man wth Asperger's syndrome takes a challenge to speak to the Presdent of the Unted States serously and embarks on a cross-country journey.;100,304;4,02; R$ 4.020.000,00 
363;Slumdog Mllonare;2008;120;Drama, Romance;8.0;84;"A Mumbateenager reflects on hs lfe after beng accused of cheatng on the ndan verson of ""Who Wants to be a Mllonare?"".";807,991;141,32; R$ 141.320.000,00 
364;Black Swan;2010;108;Drama, Thrller;8.0;79;"A commtted dancer struggles to mantan her santy after wnnng the lead role n a producton of Tchakovsky's ""Swan Lake"".";710,443;106,95; R$ 106.950.000,00 
365;Elte Squad;2007;115;Acton, Crme, Drama;8.0;33;n 1997 Ro de Janero, Captan Nascmento has to fnd a substtute for hs poston whle tryng to take down drug dealers and crmnals before the Pope vsts.;99,254;0,01; R$ 10.000,00 
366;The Avengers;2012;143;Acton, Adventure, Sc-F;8.0;69;Earth's mghtest heroes must come together and learn to fght as a team f they are gong to stop the mschevous Lokand hs alen army from enslavng humanty.;1,281,636;623,28; R$ 623.280.000,00 
367;Persepols;2007;96;Anmaton, Bography, Drama;8.0;90;A precocous and outspoken ranan grl grows up durng the slamc Revoluton.;90,004;4,45; R$ 4.450.000,00 
368;Dallas Buyers Club;2013;117;Bography, Drama;8.0;80;n 1985 Dallas, electrcan and hustler Ron Woodroof works around the system to help ADS patents get the medcaton they need after he s dagnosed wth the dsease.;451,141;27,3; R$ 27.300.000,00 
369;Lage Raho Munna Bha;2006;144;Comedy, Drama, Romance;8.0;;Munna Bhaembarks on a journey wth Mahatma Gandhn order to fght aganst a corrupt property dealer.;43,843;2,22; R$ 2.220.000,00 
370;The Pursut of Happyness;2006;117;Bography, Drama;8.0;64;A strugglng salesman takes custody of hs son as he's posed to begn a lfe-changng professonal career.;459,221;163,57; R$ 163.570.000,00 
371;Blood Damond;2006;143;Adventure, Drama, Thrller;8.0;64;A fsherman, a smuggler, and a syndcate of busnessmen match wts over the possesson of a prceless damond.;507,595;57,37; R$ 57.370.000,00 
372;The Bourne Ultmatum;2007;115;Acton, Mystery, Thrller;8.0;85;Jason Bourne dodges a ruthless C..A. offcal and hs Agents from a new assassnaton program whle searchng for the orgns of hs lfe as a traned kller.;609,594;227,47; R$ 227.470.000,00 
373;3-ron;2004;88;Crme, Drama, Romance;8.0;72;A transent young man breaks nto empty homes to partake of the vacatonng resdents' lves for a few days.;51,729;0,24; R$ 240.000,00 
374;Sn Cty;2005;124;Crme, Thrller;8.0;74;An exploraton of the dark and mserable Basn Cty and three of ts resdents, all of whom are caught up n volent corrupton.;742,717;74,1; R$ 74.100.000,00 
376;Tae Guk G: The Brotherhood of War;2004;140;Acton, Drama, War;8.0;64;When two brothers are forced to fght n the Korean War, the elder decdes to take the rskest mssons f t wll help sheld the younger from battle.;38,153;1,11; R$ 1.110.000,00 
378;Ratatoulle;2007;111;Anmaton, Adventure, Comedy;8.0;96;A rat who can cook makes an unusual allance wth a young ktchen worker at a famous restaurant.;653,922;206,45; R$ 206.450.000,00 
379;Casno Royale;2006;144;Acton, Adventure, Thrller;8.0;80;After earnng 00 status and a lcence to kll, Secret Agent James Bond sets out on hs frst msson as 007. Bond must defeat a prvate banker fundng terrorsts n a hgh-stakes game of poker at Casno Royale, Montenegro.;589,686;167,45; R$ 167.450.000,00 
380;Kll Bll: Vol. 2;2004;137;Acton, Crme, Thrller;8.0;83;The Brde contnues her quest of vengeance aganst her former boss and lover Bll, the reclusve bouncer Budd, and the treacherous, one-eyed Elle.;695,189;66,21; R$ 66.210.000,00 
381;The Return;2003;110;Drama;8.0;82;n the Russan wlderness, two brothers face a range of new, conflctng emotons when ther father - a man they know only through a sngle photograph - resurfaces.;43,273;0,5; R$ 500.000,00 
382;Sprng, Summer, Fall, Wnter... and Sprng;2003;103;Drama, Romance;8.0;85;A boy s rased by a Buddhst monk n an solated floatng temple where the years pass lke the seasons.;78,607;2,38; R$ 2.380.000,00 
383;The Sea nsde;2004;126;Bography, Drama;8.0;74;The factual story of Spanard Ramon Sampedro, who fought a thrty-year campagn n favor of euthanasa and hs own rght to de.;78,483;2,09; R$ 2.090.000,00 
384;Cnderella Man;2005;144;Bography, Drama, Hstory;8.0;69;The story of James J. Braddock, a supposedly washed-up boxer who came back to challenge for the heavyweght champonshp of the world.;178,285;61,65; R$ 61.650.000,00 
385;nfernal Affars;2002;101;Acton, Crme, Drama;8.0;75;A story between a mole n the polce department and an undercover cop. Ther objectves are the same: to fnd out who s the mole, and who s the cop.;119,008;0,17; R$ 170.000,00 
386;Prates of the Carbbean: The Curse of the Black Pearl;2003;143;Acton, Adventure, Fantasy;8.0;63;"Blacksmth Wll Turner teams up wth eccentrc prate ""Captan"" Jack Sparrow to save hs love, the governor's daughter, from Jack's former prate alles, who are now undead.";1,026,708;305,41; R$ 305.410.000,00 
387;Bg Fsh;2003;125;Adventure, Drama, Fantasy;8.0;58;A frustrated son tres to determne the fact from fcton n hs dyng father's lfe.;420,088;66,26; R$ 66.260.000,00 
388;The ncredbles;2004;115;Anmaton, Acton, Adventure;8.0;90;A famly of undercover superheroes, whle tryng to lve the quet suburban lfe, are forced nto acton to save the world.;667,177;261,44; R$ 261.440.000,00 
390;Dogvlle;2003;178;Crme, Drama;8.0;60;A woman on the run from the mob s reluctantly accepted n a small Colorado communty n exchange for labor, but when a search vsts the town she fnds out that ther support has a prce.;139,904;1,53; R$ 1.530.000,00 
392;Donne Darko;2001;113;Drama, Mystery, Sc-F;8.0;88;After narrowly escapng a bzarre accdent, a troubled teenager s plagued by vsons of a man n a large rabbt sut who manpulates hm to commt a seres of crmes.;750,232;1,48; R$ 1.480.000,00 
393;Magnola;1999;188;Drama;8.0;77;An epc mosac of nterrelated characters n search of love, forgveness, and meanng n the San Fernando Valley.;293,244;22,46; R$ 22.460.000,00 
394;Dancer n the Dark;2000;140;Crme, Drama, Muscal;8.0;61;An East European grl travels to the Unted States wth her young son, expectng t to be lke a Hollywood flm.;103,907;4,18; R$ 4.180.000,00 
395;The Straght Story;1999;112;Bography, Drama;8.0;86;An old man makes a long journey by lawnmower to mend hs relatonshp wth an ll brother.;83,45;6,2; R$ 6.200.000,00 
396;Perfect Blue;1997;81;Anmaton, Crme, Mystery;8.0;;A pop snger gves up her career to become an actress, but she slowly goes nsane when she starts beng stalked by an obsessed fan and what seems to be a ghost of her past.;61,363;0,78; R$ 780.000,00 
397;Central Staton;1998;110;Drama;8.0;80;An emotve journey of a former school teacher, who wrtes letters for llterate people, and a young boy, whose mother has just ded, as they search for the father he never knew.;37,114;5,6; R$ 5.600.000,00 
398;The ron Gant;1999;86;Anmaton, Acton, Adventure;8.0;85;A young boy befrends a gant robot from outer space that a paranod government agent wants to destroy.;175,387;23,16; R$ 23.160.000,00 
399;Slng Blade;1996;135;Drama;8.0;84;Karl Chlders, a smple man hosptalzed snce hs chldhood murder of hs mother and her lover, s released to start a new lfe n a small town.;88,262;24,48; R$ 24.480.000,00 
400;Secrets & Les;1996;136;Comedy, Drama;8.0;91;Followng the death of her adoptve parents, a successful young black optometrst establshes contact wth her bologcal mother -- a lonely whte factory worker lvng n poverty n East London.;38,695;13,42; R$ 13.420.000,00 
401;12 Monkeys;1995;129;Mystery, Sc-F, Thrller;8.0;74;n a future world devastated by dsease, a convct s sent back n tme to gather nformaton about the man-made vrus that wped out most of the human populaton on the planet.;585,922;57,14; R$ 57.140.000,00 
402;Ghost n the Shell;1995;83;Anmaton, Acton, Crme;8.0;76;A cyborg polcewoman and her partner hunt a mysterous and powerful hacker called the Puppet Master.;132,003;0,52; R$ 520.000,00 
403;The Nghtmare Before Chrstmas;1993;76;Anmaton, Famly, Fantasy;8.0;82;Jack Skellngton, kng of Halloween Town, dscovers Chrstmas Town, but hs attempts to brng Chrstmas to hs home causes confuson.;303,856;75,08; R$ 75.080.000,00 
404;Groundhog Day;1993;101;Comedy, Fantasy, Romance;8.0;72;A weatherman fnds hmself nexplcably lvng the same day over and over agan.;586,454;70,91; R$ 70.910.000,00 
405;Blood n, Blood Out;1993;180;Crme, Drama;8.0;47;Based on the true lfe experences of poet Jmmy Santago Baca, the flm focuses on step-brothers Paco and Cruz, and ther b-racal cousn Mklo.;29,277;4,5; R$ 4.500.000,00 
406;Scent of a Woman;1992;156;Drama;8.0;59;"A prep school student needng money agrees to ""babyst"" a blnd man, but the job s not at all what he antcpated.";270,823;63,9; R$ 63.900.000,00 
407;Aladdn;1992;90;Anmaton, Adventure, Comedy;8.0;86;A kndhearted street urchn and a power-hungry Grand Vzer ve for a magc lamp that has the power to make ther deepest wshes come true.;379,299;217,35; R$ 217.350.000,00 
408;JFK;1991;189;Drama, Hstory, Thrller;8.0;72;New Orleans Dstrct Attorney Jm Garrson dscovers there's more to the Kennedy assassnaton than the offcal story.;144,599;70,41; R$ 70.410.000,00 
409;Beauty and the Beast;1991;84;Anmaton, Famly, Fantasy;8.0;95;A prnce cursed to spend hs days as a hdeous monster sets out to regan hs humanty by earnng a young woman's love.;421,762;218,97; R$ 218.970.000,00 
410;Dances wth Wolves;1990;181;Adventure, Drama, Western;8.0;72;Leutenant John Dunbar, assgned to a remote western Cvl War outpost, befrends wolves and ndans, makng hm an ntolerable aberraton n the mltary.;245,31;184,21; R$ 184.210.000,00 
411;Do the Rght Thng;1989;120;Comedy, Drama;8.0;93;On the hottest day of the year on a street n the Bedford-Stuyvesant secton of Brooklyn, everyone's hate and bgotry smolders and bulds untl t explodes nto volence.;92,524;27,55; R$ 27.550.000,00 
413;Akra;1988;124;Anmaton, Acton, Sc-F;8.0;;A secret mltary project endangers Neo-Tokyo when t turns a bker gang member nto a rampagng psychc psychopath who can only be stopped by two teenagers and a group of psychcs.;168,609;0,55; R$ 550.000,00 
414;Wngs of Desre;1987;128;Drama, Fantasy, Romance;8.0;79;An angel tres of overseeng human actvty and wshes to become human when he falls n love wth a mortal.;66,133;3,33; R$ 3.330.000,00 
415;Au Revor les Enfants;1987;104;Drama, War;8.0;88;A French boardng school run by prests seems to be a haven from World War untl a new student arrves. He becomes the roommate of the top student n hs class. Rvals at frst, the roommates form a bond and share a secret.;31,803;4,54; R$ 4.540.000,00 
417;The Termnator;1984;107;Acton, Sc-F;8.0;84;A human solder s sent from 2029 to 1984 to stop an almost ndestructble cyborg kllng machne, sent from the same year, whch has been programmed to execute a young woman whose unborn son s the key to humanty's future salvaton.;807,294;38,4; R$ 38.400.000,00 
418;Pnk Floyd: The Wall;1982;95;Drama, Fantasy, Musc;8.0;47;A confned but troubled rock star descends nto madness n the mdst of hs physcal and socal solaton from everyone.;77,086;22,24; R$ 22.240.000,00 
419;Gandh;1982;191;Bography, Drama, Hstory;8.0;79;The lfe of the lawyer who became the famed leader of the ndan revolts aganst the Brtsh rule through hs phlosophy of nonvolent protest.;219,762;52,77; R$ 52.770.000,00 
421;Beng There;1979;130;Comedy, Drama;8.0;83;A smplemnded, sheltered gardener becomes an unlkely trusted advsor to a powerful busnessman and an nsder n Washngton poltcs.;66,903;30,18; R$ 30.180.000,00 
422;Anne Hall;1977;93;Comedy, Romance;8.0;92;Alvy Snger, a dvorced Jewsh comedan, reflects on hs relatonshp wth ex-lover Anne Hall, an asprng nghtclub snger, whch ended abruptly just lke hs prevous marrages.;254,435;39,2; R$ 39.200.000,00 
423;All the Presdent's Men;1976;138;Bography, Drama, Hstory;8.0;84;"""The Washngton Post"" reporters Bob Woodward and Carl Bernsten uncover the detals of the Watergate scandal that leads to Presdent Rchard Nxon's resgnaton.";105,38;70,6; R$ 70.600.000,00 
424;Jaws;1975;124;Adventure, Thrller;8.0;87;When a kller shark unleashes chaos on a beach communty, t's up to a local sherff, a marne bologst, and an old seafarer to hunt the beast down.;549,924;260; R$ 260.000.000,00 
425;Dog Day Afternoon;1975;125;Bography, Crme, Drama;8.0;86;Three amateur bank robbers plan to hold up a bank. A nce smple robbery: Walk n, take the money, and run. Unfortunately, the supposedly uncomplcated hest suddenly becomes a bzarre nghtmare as everythng that could go wrong does.;239,528;50; R$ 50.000.000,00 
