;name;year;runtme;genre;ratng;metascore;tmelne;votes;base;gross
712;The Afrcan Queen;1951;105;Adventure, Drama, Romance;7.8;91;n WWAfrca, a gn-swllng rverboat captan s persuaded by a strat-laced mssonary to use hs boat to attack an enemy warshp.;72,564;0,54; R$ 540.000,00 
724;God's Own Country;2017;104;Drama, Romance;7.7;85;Sprng. Yorkshre. Young farmer Johnny Saxby numbs hs daly frustratons wth bnge drnkng and casual sex, untl the arrval of a Romanan mgrant worker for lambng season gntes an ntense relatonshp that sets Johnny on a new path.;26,462;0,34; R$ 340.000,00 
725;Deadpool 2;2018;119;Acton, Adventure, Comedy;7.7;66;Foul-mouthed mutant mercenary Wade Wlson (a.k.a. Deadpool) assembles a team of fellow mutant rogues to protect a young boy wth supernatural abltes from the brutal, tme-travelng cyborg Cable.;497,36;324,59; R$ 324.590.000,00 
726;Wnd Rver;2017;107;Crme, Drama, Mystery;7.7;73;A veteran hunter helps an FBagent nvestgate the murder of a young woman on a Wyomng Natve Amercan reservaton.;214,004;33,8; R$ 33.800.000,00 
727;Get Out;2017;104;Horror, Mystery, Thrller;7.7;85;A young Afrcan-Amercan vsts hs whte grlfrend's parents for the weekend, where hs smmerng uneasness about ther recepton of hm eventually reaches a bolng pont.;508,338;176,04; R$ 176.040.000,00 
728;Msson: mpossble - Fallout;2018;147;Acton, Adventure, Thrller;7.7;86;Ethan Hunt and hs MF team, along wth some famlar alles, race aganst tme after a msson gone wrong.;299,17;220,16; R$ 220.160.000,00 
729;A Man Called Ove;2015;116;Comedy, Drama, Romance;7.7;70;Ove, an ll-tempered, solated retree who spends hs days enforcng block assocaton rules and vstng hs wfe's grave, has fnally gven up on lfe just as an unlkely frendshp develops wth hs bosterous new neghbors.;49,089;3,36; R$ 3.360.000,00 
730;What We Do n the Shadows;2014;86;Comedy, Horror;7.7;76;Vago, Deacon and Vladslav are vampres who are fndng that modern lfe has them strugglng wth the mundane - lke payng rent, keepng up wth the chore wheel, tryng to get nto nghtclubs and overcomng flatmate conflcts.;161,771;3,33; R$ 3.330.000,00 
731;When Marne Was There;2014;103;Anmaton, Drama, Famly;7.7;72;Due to 12 y.o. Anna's asthma, she's sent to stay wth relatves of her guardan n the Japanese countrysde. She lkes to be alone, sketchng. She befrends Marne. Who s the mysterous, blonde Marne.;34,485;0,77; R$ 770.000,00 
732;The Theory of Everythng;2014;123;Bography, Drama, Romance;7.7;72;A look at the relatonshp between the famous physcst Stephen Hawkng and hs wfe.;413,483;35,89; R$ 35.890.000,00 
733;Kngsman: The Secret Servce;2014;129;Acton, Adventure, Comedy;7.7;60;A spy organsaton recruts a promsng street kd nto the agency's tranng program, whle a global threat emerges from a twsted tech genus.;600,919;128,26; R$ 128.260.000,00 
734;The Fault n Our Stars;2014;126;Drama, Romance;7.7;69;Two teenage cancer patents begn a lfe-affrmng journey to vst a reclusve author n Amsterdam.;349,546;124,87; R$ 124.870.000,00 
735;Me and Earl and the Dyng Grl;2015;105;Comedy, Drama;7.7;74;Hgh schooler Greg, who spends most of hs tme makng parodes of classc moves wth hs co-worker Earl, fnds hs outlook forever altered after befrendng a classmate who has just been dagnosed wth cancer.;125,191;6,74; R$ 6.740.000,00 
736;Brdman or (The Unexpected Vrtue of gnorance);2014;119;Comedy, Drama;7.7;87;A washed-up superhero actor attempts to revve hs fadng career by wrtng, drectng, and starrng n a Broadway producton.;589,924;42,34; R$ 42.340.000,00 
737;The Past;2013;130;Drama, Mystery;7.7;85;An ranan man deserts hs French wfe and her two chldren to return to hs homeland. Meanwhle, hs wfe starts up a new relatonshp, a realty her husband confronts upon hs wfe's request for a dvorce.;45,621;1,33; R$ 1.330.000,00 
738;Blue s the Warmest Colour;2013;180;Drama, Romance;7.7;89;Adèle's lfe s changed when she meets Emma, a young woman wth blue har, who wll allow her to dscover desre and to assert herself as a woman and as an adult. n front of others, Adèle grows, seeks herself, loses herself, and ultmately fnds herself through love and loss.;141,259;2,2; R$ 2.200.000,00 
739;The Broken Crcle Breakdown;2012;111;Drama, Musc, Romance;7.7;70;Else and Dder fall n love at frst sght, n spte of ther dfferences. He talks, she lstens. He's a romantc athest, she's a relgous realst. When ther daughter becomes serously ll, ther love s put on tral.;39,857;0,18; R$ 180.000,00 
740;Toy Story 4;2019;100;Anmaton, Adventure, Comedy;7.7;84;"When a new toy called ""Forky"" jons Woody and the gang, a road trp alongsde old and new frends reveals how bg the world can be for a toy.";212,376;434,04; R$ 434.040.000,00 
741;Captan Amerca: The Wnter Solder;2014;136;Acton, Adventure, Sc-F;7.7;70;As Steve Rogers struggles to embrace hs role n the modern world, he teams up wth a fellow Avenger and S.H..E.L.D agent, Black Wdow, to battle a new threat from hstory: an assassn known as the Wnter Solder.;755,29;259,77; R$ 259.770.000,00 
742;Rockstar;2011;159;Drama, Musc, Romance;7.7;;Janardhan Jakhar chases hs dreams of becomng a bg Rock star, durng whch he falls n love wth Heer.;40,437;0,99; R$ 990.000,00 
743;Nebraska;2013;115;Adventure, Comedy, Drama;7.7;87;An agng, booze-addled father makes the trp from Montana to Nebraska wth hs estranged son n order to clam a mllon-dollar Mega Sweepstakes Marketng prze.;113,716;17,65; R$ 17.650.000,00 
744;Wreck-t Ralph;2012;101;Anmaton, Adventure, Comedy;7.7;72;A vdeo game vllan wants to be a hero and sets out to fulfll hs dream, but hs quest brngs havoc to the whole arcade where he lves.;386,642;189,42; R$ 189.420.000,00 
745;The Lttle Prnce;2015;108;Anmaton, Adventure, Drama;7.7;70;A lttle grl lves n a very grown-up world wth her mother, who tres to prepare her for t. Her neghbor, the Avator, ntroduces the grl to an extraordnary world where anythng s possble, the world of the Lttle Prnce.;57,881;1,34; R$ 1.340.000,00 
746;Detachment;2011;98;Drama;7.7;52;A substtute teacher who drfts from classroom to classroom fnds a connecton to the students and teachers durng hs latest assgnment.;78,77;0,07; R$ 70.000,00 
747;Mdnght n Pars;2011;94;Comedy, Fantasy, Romance;7.7;81;Whle on a trp to Pars wth hs fancée's famly, a nostalgc screenwrter fnds hmself mysterously gong back to the 1920s every day at mdnght.;394,252;56,82; R$ 56.820.000,00 
749;The Lego Move;2014;100;Anmaton, Acton, Adventure;7.7;83;"An ordnary LEGO constructon worker, thought to be the prophesed as ""specal"", s recruted to jon a quest to stop an evl tyrant from glung the LEGO unverse nto eternal stass.";328,02;257,76; R$ 257.760.000,00 
750;Gravty;2013;91;Drama, Sc-F, Thrller;7.7;96;Two astronauts work together to survve after an accdent leaves them stranded n space.;778,99;274,09; R$ 274.090.000,00 
751;Star Trek nto Darkness;2013;132;Acton, Adventure, Sc-F;7.7;72;After the crew of the Enterprse fnd an unstoppable force of terror from wthn ther own organzaton, Captan Krk leads a manhunt to a war-zone world to capture a one-man weapon of mass destructon.;466,624;228,78; R$ 228.780.000,00 
752;Beasts of No Naton;2015;137;Drama, War;7.7;79;A drama based on the experences of Agu, a chld solder fghtng n the cvl war of an unnamed Afrcan country.;75,547;0,08; R$ 80.000,00 
753;The Socal Network;2010;120;Bography, Drama;7.7;95;As Harvard student Mark Zuckerberg creates the socal networkng ste that would become known as Facebook, he s sued by the twns who clamed he stole ther dea, and by the co-founder who was later squeezed out of the busness.;638,783;96,96; R$ 96.960.000,00 
754;X: Frst Class;2011;131;Acton, Adventure, Sc-F;7.7;65;n the 1960s, superpowered humans Charles Xaver and Erk Lensherr work together to fnd others lke them, but Erk's vengeful pursut of an ambtous mutant who runed hs lfe causes a schsm to dvde them.;653,405;146,41; R$ 146.410.000,00 
755;The Hangover;2009;100;Comedy;7.7;73;Three buddes wake up from a bachelor party n Las Vegas, wth no memory of the prevous nght and the bachelor mssng. They make ther way around the cty n order to fnd ther frend before hs weddng.;727,28;277,32; R$ 277.320.000,00 
756;Skyfall;2012;143;Acton, Adventure, Thrller;7.7;81;James Bond's loyalty to M s tested when her past comes back to haunt her. When M6 comes under attack, 007 must track down and destroy the threat, no matter how personal the cost.;637,537;304,36; R$ 304.360.000,00 
757;Slver Lnngs Playbook;2012;122;Comedy, Drama, Romance;7.7;81;After a stnt n a mental nsttuton, former teacher Pat Soltano moves back n wth hs parents and tres to reconcle wth hs ex-wfe. Thngs get more challengng when Pat meets Tffany, a mysterous grl wth problems of her own.;670,721;132,09; R$ 132.090.000,00 
758;Argo;2012;120;Bography, Drama, Thrller;7.7;86;Actng under the cover of a Hollywood producer scoutng a locaton for a scence fcton flm, a CA agent launches a dangerous operaton to rescue sx Amercans n Tehran durng the U.S. hostage crss n ran n 1979.;581,343;136,03; R$ 136.030.000,00 
759;500 Days of Summer;2009;95;Comedy, Drama, Romance;7.7;76;An offbeat romantc comedy about a woman who doesn't beleve true love exsts, and the young man who falls for her.;478,952;32,39; R$ 32.390.000,00 
760;Harry Potter and the Deathly Hallows: Part 1;2010;146;Adventure, Famly, Fantasy;7.7;65;As Harry, Ron, and Hermone race aganst tme and evl to destroy the Horcruxes, they uncover the exstence of the three most powerful objects n the wzardng world: the Deathly Hallows.;489,893;295,98; R$ 295.980.000,00 
761;Ponyo;2008;101;Anmaton, Adventure, Comedy;7.7;86;A fve-year-old boy develops a relatonshp wth Ponyo, a young goldfsh prncess who longs to become a human after fallng n love wth hm.;128,887;15,09; R$ 15.090.000,00 
762;Frost/Nxon;2008;122;Bography, Drama, Hstory;7.7;80;A dramatc retellng of the post-Watergate televson ntervews between Brtsh talk-show host Davd Frost and former presdent Rchard Nxon.;104,268;18,59; R$ 18.590.000,00 
763;Paprka;2006;90;Anmaton, Drama, Fantasy;7.7;81;When a machne that allows therapsts to enter ther patents' dreams s stolen, all hell breaks loose. Only a young female therapst, Paprka, can stop t.;73,514;0,88; R$ 880.000,00 
764;Changelng;2008;141;Bography, Crme, Drama;7.7;63;Gref-strcken mother Chrstne Collns (Angelna Jole) takes on the L.A.P.D. to her own detrment when t tres to pass off an obvous mpostor as her mssng chld.;242,023;35,74; R$ 35.740.000,00 
765;Flpped;2010;90;Comedy, Drama, Romance;7.7;45;Two eghth-graders start to have feelngs for each other despte beng total oppostes.;82,993;1,75; R$ 1.750.000,00 
768;Ths s England;2006;101;Crme, Drama;7.7;86;A young boy becomes frends wth a gang of sknheads. Frends soon become lke famly, and relatonshps wll be pushed to the very lmt.;116,768;0,33; R$ 330.000,00 
769;Ex Machna;2014;108;Drama, Sc-F, Thrller;7.7;78;A young programmer s selected to partcpate n a ground-breakng experment n synthetc ntellgence by evaluatng the human qualtes of a hghly advanced humanod A..;484,239;25,44; R$ 25.440.000,00 
770;After the Weddng;2006;120;Drama;7.7;78;A manager of an orphanage n nda s sent to Copenhagen, Denmark, where he dscovers a lfe-alterng famly secret.;32,793;0,41; R$ 410.000,00 
771;The Last Kng of Scotland;2006;123;Bography, Drama, Hstory;7.7;74;Based on the events of the brutal Ugandan dctator dAmn's regme as seen by hs personal physcan durng the 1970s.;177,636;17,61; R$ 17.610.000,00 
772;Zodac;2007;157;Crme, Drama, Mystery;7.7;78;n the late 1960s/early 1970s, a San Francsco cartoonst becomes an amateur detectve obsessed wth trackng down the Zodac Kller, an undentfed ndvdual who terrorzes Northern Calforna wth a kllng spree.;480,155;33,08; R$ 33.080.000,00 
773;Lucky Number Slevn;2006;110;Crme, Drama, Thrller;7.7;53;A case of mstaken dentty lands Slevn nto the mddle of a war beng plotted by two of the cty's most rval crme bosses. Under constant survellance by Detectve Brkowskand assassn Goodkat, he must get them before they get hm.;301,854;22,49; R$ 22.490.000,00 
774;Joyeux Noel;2005;116;Drama, Hstory, Musc;7.7;70;n December 1914, an unoffcal Chrstmas truce on the Western Front allows solders from opposng sdes of the Frst World War to gan nsght nto each other's way of lfe.;28,249;1,05; R$ 1.050.000,00 
775;Control;2007;122;Bography, Drama, Musc;7.7;78;A profle of an Curts, the engmatc snger of Joy Dvson whose personal, professonal, and romantc troubles led hm to commt sucde at the age of 23.;62,281;0,87; R$ 870.000,00 
776;Tangled;2010;100;Anmaton, Adventure, Comedy;7.7;71;The magcally long-hared Rapunzel has spent her entre lfe n a tower, but now that a runaway thef has stumbled upon her, she s about to dscover the world for the frst tme, and who she really s.;413,048;200,82; R$ 200.820.000,00 
777;Black Book;2006;145;Drama, Thrller, War;7.7;71;n the Naz-occuped Netherlands durng World War , a Jewsh snger nfltrates the regonal Gestapo headquarters for the Dutch resstance.;73,481;4,4; R$ 4.400.000,00 
778;Brokeback Mountan;2005;134;Drama, Romance;7.7;87;Enns and Jack are two shepherds who develop a sexual and emotonal relatonshp. Ther relatonshp becomes complcated when both of them get marred to ther respectve grlfrends.;329,316;83,04; R$ 83.040.000,00 
779;3:10 to Yuma;2007;122;Acton, Crme, Drama;7.7;76;A small-tme rancher agrees to hold a captured outlaw who's awatng a tran to go to court n Yuma. A battle of wlls ensues as the outlaw tres to psych out the rancher.;293,137;53,61; R$ 53.610.000,00 
780;Crash;2004;112;Crme, Drama, Thrller;7.7;66;Los Angeles ctzens wth vastly separate lves collde n nterweavng stores of race, loss and redempton.;423,089;54,58; R$ 54.580.000,00 
781;Kung Fu Hustle;2004;99;Acton, Comedy, Fantasy;7.7;78;"n Shangha, Chna n the 1940s, a wannabe gangster aspres to jon the notorous ""Axe Gang"" whle resdents of a housng complex exhbt extraordnary powers n defendng ther turf.";129,411;17,11; R$ 17.110.000,00 
782;The Bourne Supremacy;2004;108;Acton, Mystery, Thrller;7.7;73;When Jason Bourne s framed for a CA operaton gone awry, he s forced to resume hs former lfe as a traned assassn to survve.;439,942;176,24; R$ 176.240.000,00 
783;The Machnst;2004;101;Drama, Thrller;7.7;61;An ndustral worker who hasn't slept n a year begns to doubt hs own santy.;363,703;1,08; R$ 1.080.000,00 
784;Ray;2004;152;Bography, Drama, Musc;7.7;73;The story of the lfe and career of the legendary rhythm and blues muscan Ray Charles, from hs humble begnnngs n the South, where he went blnd at age seven, to hs meteorc rse to stardom durng the 1950s and 1960s.;140,336;75,33; R$ 75.330.000,00 
785;Lost n Translaton;2003;102;Comedy, Drama;7.7;89;A faded move star and a neglected young woman form an unlkely bond after crossng paths n Tokyo.;423,037;44,59; R$ 44.590.000,00 
786;Harry Potter and the Goblet of Fre;2005;157;Adventure, Famly, Fantasy;7.7;81;Harry Potter fnds hmself competng n a hazardous tournament between rval schools of magc, but he s dstracted by recurrng nghtmares.;560,123;290,01; R$ 290.010.000,00 
787;Man on Fre;2004;146;Acton, Crme, Drama;7.7;47;n Mexco Cty, a former CA operatve swears vengeance on those who commtted an unspeakable act aganst the famly he was hred to protect.;334,095;77,91; R$ 77.910.000,00 
788;Coralne;2009;100;Anmaton, Drama, Famly;7.7;80;An adventurous 11-year-old grl fnds another world that s a strangely dealzed verson of her frustratng home, but t has snster secrets.;201,815;75,29; R$ 75.290.000,00 
789;The Last Samura;2003;154;Acton, Drama;7.7;55;An Amercan mltary advsor embraces the Samuraculture he was hred to destroy after he s captured n battle.;405,896;111,11; R$ 111.110.000,00 
790;The Magdalene Ssters;2002;114;Drama;7.7;83;Three young rsh women struggle to mantan ther sprts whle they endure dehumanzng abuse as nmates of a Magdalene Ssters Asylum.;26,206;4,89; R$ 4.890.000,00 
791;Fndng Neverland;2004;106;Bography, Drama, Famly;7.7;67;The story of Sr J.M. Barre's frendshp wth a famly who nspred hm to create Peter Pan.;200,324;51,68; R$ 51.680.000,00 
792;Good Bye Lenn!;2003;121;Comedy, Drama, Romance;7.7;68;n 1990, to protect hs fragle mother from a fatal shock after a long coma, a young man must keep her from learnng that her beloved naton of East Germany as she knew t has dsappeared.;139,69;4,06; R$ 4.060.000,00 
793;n Amerca;2002;105;Drama;7.7;76;A famly of rsh mmgrants adjust to lfe on the mean streets of Hell's Ktchen whle also grevng the death of a chld.;40,67;15,54; R$ 15.540.000,00 
794;Adaptaton.;2002;115;Comedy, Drama;7.7;83;A lovelorn screenwrter becomes desperate as he tres and fals to adapt 'The Orchd Thef' by Susan Orlean for the screen.;181,115;22,25; R$ 22.250.000,00 
795;Black Hawk Down;2001;144;Drama, Hstory, War;7.7;74;160 elte U.S. solders drop nto Somala to capture two top leutenants of a renegade warlord and fnd themselves n a desperate battle wth a large force of heavly-armed Somals.;369,347;108,64; R$ 108.640.000,00 
796;Road to Perdton;2002;117;Crme, Drama, Thrller;7.7;72;A mob enforcer's son wtnesses a murder, forcng hm and hs father to take to the road, and hs father down a path of redempton and revenge.;250,584;104,45; R$ 104.450.000,00 
797;The Experment;2001;120;Drama, Thrller;7.7;60;"For two weeks, 20 male partcpants are hred to play prsoners and guards n a prson. The ""prsoners"" have to follow seemngly mld rules, and the ""guards"" are told to retan order wthout usng physcal volence.";91,497;0,14; R$ 140.000,00 
798;Blly Ellot;2000;110;Drama, Musc;7.7;74;A talented young boy becomes torn between hs unexpected love of dance and the dsntegraton of hs famly.;128,384;22; R$ 22.000.000,00 
799;Hedwg and the Angry nch;2001;95;Comedy, Drama, Musc;7.7;85;A gender-queer punk-rock snger from East Berln tours the U.S. wth her band as she tells her lfe story and follows the former lover/band-mate who stole her songs.;32,33;3,03; R$ 3.030.000,00 
800;The Count of Monte Crsto;2002;131;Acton, Adventure, Drama;7.7;61;"A young man, falsely mprsoned by hs jealous ""frend"", escapes and uses a hdden treasure to exact hs revenge.";130,771;54,23; R$ 54.230.000,00 
801;Ocean's Eleven;2001;116;Crme, Thrller;7.7;74;Danny Ocean and hs ten accomplces plan to rob three Las Vegas casnos smultaneously.;525,663;183,42; R$ 183.420.000,00 
802;Vampre Hunter D: Bloodlust;2000;103;Anmaton, Acton, Fantasy;7.7;62;When a grl s abducted by a vampre, a legendary bounty hunter s hred to brng her back.;29,767;0,15; R$ 150.000,00 
803;O Brother, Where Art Thou?;2000;107;Adventure, Comedy, Crme;7.7;69;n the deep south durng the 1930s, three escaped convcts search for hdden treasure whle a relentless lawman pursues them.;292,711;45,51; R$ 45.510.000,00 
805;South Park: Bgger, Longer & Uncut;1999;81;Anmaton, Comedy, Fantasy;7.7;73;When Stan Marsh and hs frends go see an R-rated move, they start cursng and ther parents thnk that Canada s to blame.;193,849;52,04; R$ 52.040.000,00 
806;Offce Space;1999;89;Comedy;7.7;68;Three company workers who hate ther jobs decde to rebel aganst ther greedy boss.;246,036;10,82; R$ 10.820.000,00 
807;Happness;1998;134;Comedy, Drama;7.7;81;The lves of several ndvduals ntertwne as they go about ther lves n ther own unque ways, engagng n acts socety as a whole mght fnd dsturbng n a desperate search for human connecton.;67,162;2,81; R$ 2.810.000,00 
808;Tranng Day;2001;122;Crme, Drama, Thrller;7.7;69;A rooke cop spends hs frst day as a Los Angeles narcotcs offcer wth a rogue detectve who sn't what he appears to be.;399,865;76,63; R$ 76.630.000,00 
809;Run Lola Run;1998;80;Crme, Drama, Thrller;7.7;77;After a botched money delvery, Lola has 20 mnutes to come up wth 100,000 Deutschmarks.;190,114;7,27; R$ 7.270.000,00 
810;Rushmore;1998;93;Comedy, Drama, Romance;7.7;86;The extracurrcular kng of Rushmore Preparatory School s put on academc probaton.;172,512;17,11; R$ 17.110.000,00 
811;Open Your Eyes;1997;119;Drama, Mystery, Sc-F;7.7;;A very handsome man fnds the love of hs lfe, but he suffers an accdent and needs to have hs face rebult by surgery after t s severely dsfgured.;64,914;0,37; R$ 370.000,00 
812;Beng John Malkovch;1999;113;Comedy, Drama, Fantasy;7.7;90;A puppeteer dscovers a portal that leads lterally nto the head of move star John Malkovch.;317,034;22,86; R$ 22.860.000,00 
813;Taste of Cherry;1997;95;Drama;7.7;80;An ranan man drves hs truck n search of someone who wll quetly bury hm under a cherry tree after he commts sucde.;25,213;0,31; R$ 310.000,00 
814;As Good as t Gets;1997;139;Comedy, Drama, Romance;7.7;67;A sngle mother and watress, a msanthropc author, and a gay artst form an unlkely frendshp after the artst s assaulted n a robbery.;279,839;148,48; R$ 148.480.000,00 
815;The Ffth Element;1997;126;Acton, Adventure, Sc-F;7.7;52;n the colorful future, a cab drver unwttngly becomes the central fgure n the search for a legendary cosmc weapon to keep Evl and Mr. Zorg at bay.;440,578;63,54; R$ 63.540.000,00 
816;Le Dîner de Cons;1998;80;Comedy;7.7;73;A few frends have a weekly fools' dnner, where each brngs a fool along. Perre fnds a champon fool for next dnner. Surprse.;38,004;4,07; R$ 4.070.000,00 
817;Donne Brasco;1997;127;Bography, Crme, Drama;7.7;76;An FBundercover agent nfltrates the mob and fnds hmself dentfyng more wth the mafa lfe, at the expense of hs regular one.;285,167;41,91; R$ 41.910.000,00 
818;Shne;1996;105;Bography, Drama, Musc;7.7;87;Panst Davd Helfgott, drven by hs father and teachers, has a breakdown. Years later he returns to the pano, to popular f not crtcal acclam.;51,933;35,81; R$ 35.810.000,00 
819;Prmal Fear;1996;129;Crme, Drama, Mystery;7.7;47;An altar boy s accused of murderng a prest, and the truth s bured several layers deep.;193,929;56,12; R$ 56.120.000,00 
820;Hamlet;1996;242;Drama;7.7;;Hamlet, Prnce of Denmark, returns home to fnd hs father murdered and hs mother remarryng the murderer, hs uncle. Meanwhle, war s brewng.;36,34;4,41; R$ 4.410.000,00 
821;Sense and Sensblty;1995;136;Drama, Romance;7.7;84;Rch Mr. Dashwood des, leavng hs second wfe and her three daughters poor by the rules of nhertance. The two eldest daughters are the ttle oppostes.;104,866;43,18; R$ 43.180.000,00 
822;A Lttle Prncess;1995;97;Drama, Famly, Fantasy;7.7;83;A young grl s relegated to servtude at a boardng school when her father goes mssng and s presumed dead.;32,659;10,02; R$ 10.020.000,00 
824;l Postno;1994;108;Bography, Comedy, Drama;7.7;81;A smple talan postman learns to love poetry whle delverng mal to a famous poet, and then uses ths to woo local beauty Beatrce.;34,251;21,85; R$ 21.850.000,00 
825;Clerks;1994;92;Comedy;7.7;70;A day n the lves of two convenence clerks named Dante and Randal as they annoy customers, dscuss moves, and play hockey on the store roof.;213,316;3,15; R$ 3.150.000,00 
826;What's Eatng Glbert Grape;1993;118;Drama;7.7;73;A young man n a small Mdwestern town struggles to care for hs mentally-dsabled younger brother and morbdly obese mother whle attemptng to pursue hs own happness.;218,94;9,17; R$ 9.170.000,00 
827;Short Cuts;1993;188;Comedy, Drama;7.7;79;The day-to-day lves of several suburban Los Angeles resdents.;42,779;6,11; R$ 6.110.000,00 
828;Phladelpha;1993;125;Drama;7.7;66;When a man wth HV s fred by hs law frm because of hs condton, he hres a homophobc small tme lawyer as the only wllng advocate for a wrongful dsmssal sut.;227,888;77,32; R$ 77.320.000,00 
829;The Muppet Chrstmas Carol;1992;85;Comedy, Drama, Famly;7.7;64;The Muppet characters tell ther verson of the classc tale of an old and btter mser's redempton on Chrstmas Eve.;50,836;27,28; R$ 27.280.000,00 
830;Malcolm X;1992;202;Bography, Drama, Hstory;7.7;73;Bographcal epc of the controversal and nfluental Black Natonalst leader, from hs early lfe and career as a small-tme gangster, to hs mnstry as a member of the Naton of slam.;87,887;48,17; R$ 48.170.000,00 
831;The Last of the Mohcans;1992;112;Acton, Adventure, Drama;7.7;76;Three trappers protect the daughters of a Brtsh Colonel n the mdst of the French and ndan War.;154,259;75,51; R$ 75.510.000,00 
833;Glengarry Glen Ross;1992;100;Crme, Drama, Mystery;7.7;82;An examnaton of the machnatons behnd the scenes at a real estate offce.;97,343;10,73; R$ 10.730.000,00 
834;A Few Good Men;1992;138;Drama, Thrller;7.7;62;Mltary lawyer Leutenant Danel Kaffee defends Marnes accused of murder. They contend they were actng under orders.;240,007;141,34; R$ 141.340.000,00 
835;Nght on Earth;1991;129;Comedy, Drama;7.7;68;An anthology of 5 dfferent cab drvers n 5 Amercan and European ctes and ther remarkable fares on the same eventful nght.;56,428;2,02; R$ 2.020.000,00 
836;Fred Green Tomatoes;1991;130;Drama;7.7;64;A housewfe who s unhappy wth her lfe befrends an old lady n a nursng home and s enthralled by the tales she tells of people she used to know.;68,322;82,42; R$ 82.420.000,00 
837;Barton Fnk;1991;116;Comedy, Drama, Thrller;7.7;69;A renowned New York playwrght s entced to Calforna to wrte for the moves and dscovers the hellsh truth of Hollywood.;114,874;6,15; R$ 6.150.000,00 
838;Mller's Crossng;1990;115;Crme, Drama, Thrller;7.7;66;Tom Reagan, an advsor to a Prohbton-era crme boss, tres to keep the peace between warrng mobs but gets caught n dvded loyaltes.;127,56;5,08; R$ 5.080.000,00 
839;Who Framed Roger Rabbt;1988;104;Anmaton, Adventure, Comedy;7.7;83;A toon-hatng detectve s a cartoon rabbt's only hope to prove hs nnocence when he s accused of murder.;184,885;156,45; R$ 156.450.000,00 
841;The Last Emperor;1987;163;Bography, Drama, Hstory;7.7;76;The story of the fnal Emperor of Chna.;96,324;43,98; R$ 43.980.000,00 
842;Evl Dead ;1987;84;Comedy, Horror;7.7;72;The lone survvor of an onslaught of flesh-possessng sprts holes up n a cabn wth a group of strangers whle the demons contnue ther attack.;150,394;5,92; R$ 5.920.000,00 
